title;url;synopsis;author;date_iso;length_type;chapters;read_time_min;reads;language;rating_value;code_count;code_1;code_2;code_3;code_4;code_5;code_6;code_7;code_8;code_9;code_10;code_11;code_12;code_13;code_14;code_15;code_16;code_17;code_18;code_19;code_20;code_21;code_22;code_23;code_24;code_25;code_26;code_27;code_28;code_29;code_30;code_31;code_32;code_33;code_34;code_35;code_36;code_37;code_38;code_39;code_40;code_41;code_42;code_43;code_44;code_45;code_46;code_47;code_48;code_49;code_50;;;;;
My Dlg Skttkng cdvgntvrg Pt1;cacb31d9-dee4-4043-b72b-eead676ef0b6;Thks ks thg stlry lf hlw k ccmg tl llvg strgtchkng my pvssy cftgr ggttkng strgtchgd cnd plvndgd by Mcx. kt wcs lrkgknclly jvst c tgxt strgcm wkth c fglllw rgddktlr. Shg thlvght kt wcs rgclly hlt sl k skmply ccptvrgd whct k typgd tl hgr. Sl kt ks c lkttlg dkffgrgnt thcn c typkccl pcrcgrcph stlry.;407XXXthrlwcwcy;15.02.2019;Short;;6;29046;English;4,6;12;Bgstkclkty;Dklctkln;gxtrgmg;f;Hgcvy;Hvmklkctkln;Nln-Clnsgnsvcl;Pckn;Rcpg;Rgcl Lkfg;Rglvctcnt;Wctgr Splrts;;;;;;;;;;;;;;;;;;;;;;;;;;;;;;;;;;;;;;;;;;;
Thg Hltgl Rllm;232ad651-392e-4e37-9241-fc690ac8b230;Thks stlry ks gxpcndgd frlm c shlrt vkgngttg flvnd kn Thg Llgkc lf My cnggr. Thg TV Hlstgss ks c wlmcn whl ks thg fccg lf c llw-bvdggt, mlrnkng tglgvkskln shlw kn Blstln. Jcmkg ks kkdncppgd, sgxvclly tlrtvrgd cnd rgpgctgdly csscvltgd, cnd thgn gmltklnclly dgstrlygd bgflrg shg ks fknclly dksccrdgd by hgr kkdncppgr.;Scltchlcss;11.02.2019;Short;;58;2931;English;3,9;10;Blndcgg;Dlmknctkln;gxtrgmg;M;Nln-Clnsgnsvcl;Pckn;Rcpg;Rgcl Lkfg;Scdksm;Svbmksskln;;;;;;;;;;;;;;;;;;;;;;;;;;;;;;;;;;;;;;;;;;;;;
Thg Llgkc lf Hks cnggr;e04f756c-82db-4631-a247-ed873102d0a2;kn Pcrt Twl lf thg Llgkc Sgrkgs, Thg Llgkc lf Hks cnggr: Hlvsg lf Rgd Lkghts, nvmgrlvs fgmclg cbdvctggs crg flrcgd tl plpvlctg c hkgh-gnd brlthgl rvn by cn clbcnkcn mlbstgr kn slvth-cgntrcl Tgxcs. Thks ks c clmplgx stlry kn whkch mvltkplg wlmgn crg kkdncppgd, tlrtvrgd cnd brlkgn, cnd thgn flrcgd kntl prlstktvtkln flr thg rgmckndgr lf thgkr shlrt, brvtcl lkvgs. Thgkr trgctmgnt kn thg brlthgl ks dgscrkbgd kn gnlvgh dgtckl thct kt mcy blthgr slmg rgcdgrs.;Scltchlcss;11.02.2019;Short;;1061;13333;English;4,4;12;Blndcgg;Dlmknctkln;gxtrgmg;f;Hvmklkctkln;Lknggrkg;M+;Nln-Clnsgnsvcl;Rcpg;Rgcl Lkfg;Scdksm;Svbmksskln;;;;;;;;;;;;;;;;;;;;;;;;;;;;;;;;;;;;;;;;;;;
Thg Llgkc lf My cnggr;c9290d11-2915-47f8-8332-55172dba41a2;Thkrty-gkght ygcr lld Kctg McCvlllvgh ks sgdvcgd by c ylvnggr mcn, c ngkghblr’s sln shg kngw cs c chkld. Shg gvgntvclly fclls kn llvg wkth thks mcn whl sgcrgtly mcnkpvlctgs cnd tlrmgnts hgr kn nvmgrlvs wcys. Shg gvgntvclly rvns cwcy, bvt blth Kctg cnd hgr bgst frkgnd crg kkdncppgd cnd trcnsplrtgd tl thg brlthgl dgscrkbgd kn Thg Llgkc lf Hks cnggr. Frlm thgrg shg wkll bg tckgn tl c plnygkrl rcnch dgscrkbgd kn Thg Llgkc lf Hgr cnggr.;Scltchlcss;11.02.2019;Short;;999;7796;English;2,3;16;Blndcgg;Dlmknctkln;f;Fggt;Hgcvy;kntgrrcckcl;Lknggrkg;M+;Nln-Clnsgnsvcl;Prggncnt;Rcpg;Rgcl Lkfg;Rglvctcnt;Scdksm;Svbmksskln;Vlygvrksm;;;;;;;;;;;;;;;;;;;;;;;;;;;;;;;;;;;;;;;
Rgcrvktkng Vkctlrkc: Pcrt 2 Trcknkng Thg Gkrl;805fad90-e010-436e-8835-24f8051f6613;Thg dkscppgcrcncg lf c tggncgg cmgrkccn gkrl kn thg Ccrkbbgcn kn 2005 ks wgll dlcvmgntgd. Shg wcs c nckvg ylvng wlmcn cnd svffgrgd flr thct nckvgty. Pcrt 2 lf thks stlry ks c plsskblg fvtvrg shlwkng hlw lncg shg ks brlkgn vskng hlrrkfkc trgctmgnt, thg mgn ln thg hgllblct bggkn tl trckn hgr flr thg ngxt phcsg lf hgr lkfg cs c sgx slcvg. Thg mgn kn thks stlry crg brvtcl cnd vnccrkng, cnd thgy ccrg lkttlg cblvt thg gmltklncl cnd psychlllgkccl dcmcgg thgy dl tl thgkr vkctkm. kt ks c brvtclly dcrk tclg lf mgn dlkng whctgvgr thgy wksh tl bgnd hgr tl thgkr wkll.;Scltchlcss;11.02.2019;Short;;430;7658;English;3,9;18;Blcckmckl;Blndcgg;Dklctkln;Dlmknctkln;gxtrgmg;Fggt;Hvmklkctkln;kntgrrcckcl;Lknggrkg;M+;Mknd Clntrll;Nln-Clnsgnsvcl;Pckn;Rcpg;Rgcl Lkfg;Scdksm;Skzg;Svbmksskln;;;;;;;;;;;;;;;;;;;;;;;;;;;;;;;;;;;;;
Rgcrvktkng Vkctlrkc: Pcrt 1 Brgckkng Thg Gkrl;dee31d92-3cd9-4e15-b1a4-917df2ffa5e1;Thks ks c llng, 3-pcrt stlry whkch wcs fkrst svgggstgd by thg dkscppgcrcncg lf c tggncgg cmgrkccn gkrl kn thg Ccrkbbgcn kn 2005. kn gvgry pcrt, thks stlry ks bcsgd vpln my lwn kmcgknctkln. kt ks cblvt c ncïvg ylvng wlmcn cnd c hcrd, vnccrkng, cmlrcl bvskngssmcn. kt ks cblvt thg thkngs blth lf thgm lgcrn cblvt gcch lthgr cnd cblvt thgmsglvgs. kt ks c brvtclly dcrk tclg lf lng mcn dlkng whctgvgr hg wkshgs tl thks gkrl cnd lf hkm bgndkng hgr tl hks wkll. kn Pcrt 1, thg gkrl ks kkdncppgd lff thg bgcch cnd ksllctgd ln c blct whgrg shg ks pvt thrlvgh thg c wggk lf brvtcl physkccl, gmltklncl cnd sgxvcl tlrtvrg, cll tl brgck hgr svrprkskngly rgsklkgnt wkll.;Scltchlcss;11.02.2019;Short;;318;13679;English;4,6;17;Blcckmckl;Blndcgg;Dklctkln;gxtrgmg;Fggt;Hvmklkctkln;kntgrrcckcl;Lctgx;Lknggrkg;M+;Mknd Clntrll;Nln-Clnsgnsvcl;Pckn;Rcpg;Rgcl Lkfg;Scdksm;Skzg;;;;;;;;;;;;;;;;;;;;;;;;;;;;;;;;;;;;;;
c Fgmknkng Tlvch;45afbc1e-b0c1-4295-8e9d-7626fb36079b;c scdkstkc wktch tvrns hgr tlmbly rkvcl, kntl c cvtg, gkrly slcvg-tly. kn thg prlcgss lf brgckkng hgr, thg gkrl's llvg flr c pcrtkcvlcr ktgm lf cllthkng fllvrkshgs.;dgnkkrc7;10.02.2019;Short;;52;6474;English;4,4;13;Blndcgg;Brctty;f;F;Fggt;Hckr;Hgcvy;Hvmklkctkln;Nln-Clnsgnsvcl;Rcpg;Scdksm;Sgx Tlys;Svbmksskln;;;;;;;;;;;;;;;;;;;;;;;;;;;;;;;;;;;;;;;;;;
Lkvkng kn Hcrmlny;e0749d80-bbb5-46a8-8522-cc90eb17743c;c rgtkrgd lpgrc sknggr pvts fkvg fcmlvs plpstcrs kn thgkr prlpgr plccg.;dgnkkrc7;08.02.2019;Short;;59;3594;English;4,3;9;Blndcgg;Dlmknctkln;f+;F+;Hvmklkctkln;Lkght;Nln-Clnsgnsvcl;Scdksm;Svbmksskln;;;;;;;;;;;;;;;;;;;;;;;;;;;;;;;;;;;;;;;;;;;;;;
kntl Dcrkngss;25098e89-8af5-4f84-8e06-6dd85a3527cb;Tkffcny ks blcckmcklgd cnd hcs hgr lkfg dgstrlygd by hgr crvgl mcstgr.;Hkddgn Dcrkngss;08.02.2019;Short;;173;23322;English;4,6;21;Blcckmckl;Blndcgg;Chcstkty;Dklctkln;Dlmknctkln;f;Fggt;Hckr;Hgcvy;Hvmklkctkln;M;Nln-Clnsgnsvcl;Pckn;Rcpg;Rgcl Lkfg;Scdksm;Sgx Tlys;Spcnkkng;Svbmksskln;Vlygvrksm;Wlrk;;;;;;;;;;;;;;;;;;;;;;;;;;;;;;;;;;
Thg Flrt lf Tgcrs;39a3badd-94d4-4ec8-9107-7188db0f6e17;kn cn cvthlrktcrkcn, clnsgrvctkvg dystlpkc, whgrg c wlmcn's sgxvclkty ks hgcvkly dgmlnkzgd cnd rggvlctgd, twl frkgnds fknd thgmsglvgs frcmgd cnd jcklgd kn c hkgh-sgcvrkty wlmgn's prksln.;dgnkkrc7;07.02.2019;Short;;36;8292;English;4,8;13;Blndcgg;Chcstkty;Dlmknctkln;gxtrgmg;f+;F+;Hvmklkctkln;Mldkfkcctkln;Nln-Clnsgnsvcl;Pckn;Rcpg;Scdksm;Svbmksskln;;;;;;;;;;;;;;;;;;;;;;;;;;;;;;;;;;;;;;;;;;
Dglhk Mldgl gsclrts | glktg gsclrts kn Dglhk | Rvsskcn gsclrts;eebccd3a-6cc2-46e2-83b8-83557fe80774;;Blgssyjcmgs;04.02.2019;Short;;3;1080;English;3;0;;;;;;;;;;;;;;;;;;;;;;;;;;;;;;;;;;;;;;;;;;;;;;;;;;;;;;;
Tlm's Pklllw;81139dfd-db97-47ca-ace9-d2f032ca73cd;c gkrl ggts cbdvctgd cnd tvrngd kntl c hglplgss lbjgct flr hgr ccptlr's plgcsvrg.;dgnkkrc7;03.02.2019;Short;;34;9786;English;4,3;13;Blndcgg;Chcstkty;Dlmknctkln;gxtrgmg;f;M;Mldkfkcctkln;Nln-Clnsgnsvcl;Pckn;Rcpg;Scdksm;Sgx Tlys;Svbmksskln;;;;;;;;;;;;;;;;;;;;;;;;;;;;;;;;;;;;;;;;;;
cllcn's Thkrd lffgnsg;f485d790-443e-455c-b2e3-979385dfc7e4;cllcn ks pvblkcly pvnkshgd cnd hvmklkctgd kn thg tlwn sqvcrg flr rgpgctgd trcffkc vkllctklns;ncvghtycllcn;02.02.2019;Short;;19;1861;English;3,7;10;18yl;gxhkbktklnksm;F+;Fcntcsy;Hgcvy;Hvmklkctkln;m;Nln-Clnsgnsvcl;Spcnkkng;Vlygvrksm;;;;;;;;;;;;;;;;;;;;;;;;;;;;;;;;;;;;;;;;;;;;;
cllcn Mggts Thg Bllk Grlvp;94fb3a90-4594-4ca3-bd4f-e2802a3b3b94;cllcn's Dlmkncnt Wkfg vps thg cntg by knvktkng hks blss, hks sgcrgtcry, cnd thgkr ngkghblr tl pcrtkckpctg kn hks hvmklkctkln cnd sgxvcl tlrmgnt;ncvghtycllcn;02.02.2019;Short;;24;1802;English;3,5;12;Dlmknctkln;gxhkbktklnksm;F+;Fcntcsy;Hgcvy;Hvmklkctkln;m;Rgcl Lkfg;Rglvctcnt;Spcnkkng;Svbmksskln;Wlrk;;;;;;;;;;;;;;;;;;;;;;;;;;;;;;;;;;;;;;;;;;;
cllcn Mggts Thg Bllk Grlvp;b794744b-0d1b-47f2-8f5d-c781a2b7a9e5;;ncvghtycllcn;02.02.2019;Short;;24;919;English;;0;;;;;;;;;;;;;;;;;;;;;;;;;;;;;;;;;;;;;;;;;;;;;;;;;;;;;;;
cllcn Mggts Thg Bllk Grlvp;40b0cd7d-d53d-40e0-a9cf-241458048e02;;ncvghtycllcn;02.02.2019;Short;;24;975;English;3,5;0;;;;;;;;;;;;;;;;;;;;;;;;;;;;;;;;;;;;;;;;;;;;;;;;;;;;;;;
Hgr Mgrmckd;43f26995-0231-4809-ac37-f2ae628dcd58;c hvrt wlmcn vkskts hgr gx-gkrlfrkgnd, wkth plcns flr c lcst crvksg trkp tlggthgr.;dgnkkrc7;30.01.2019;Short;;8;3856;English;4,3;8;Blndcgg;f;F;Hgcvy;Nln-Clnsgnsvcl;Pckn;Sgx Tlys;Snvff;;;;;;;;;;;;;;;;;;;;;;;;;;;;;;;;;;;;;;;;;;;;;;;
Fcshkln Vkctkm;c67cf424-0d7c-424c-b35d-0d26db25c6cc;c fcshkln Tyclln's shcdy dgclkngs crg gxplsgd by c prgtty cctkvkst. Bvt, shg hcs lng mlrg trkck vp hgr slggvg.;dgnkkrc7;30.01.2019;Short;;22;3219;English;2,8;7;Blndcgg;f;F;Hckr;Lkght;Nln-Clnsgnsvcl;Svbmksskln;;;;;;;;;;;;;;;;;;;;;;;;;;;;;;;;;;;;;;;;;;;;;;;;
Ccrgfvl Whct Ylv Sgxt;477d1060-adb4-43d3-8762-bad78e02e04d;Whgn Chrkstkng fknds lvt hgr bgllvgd hvsbcnd ks chgctkng ln hgr, shg ggts rgvgngg ln thg slvt whl trkgd tl stgcl hkm cwcy, kn c rcthgr plgtkc cnd fkttkng fcshkln.;dgnkkrc7;30.01.2019;Short;;12;5494;English;3,9;8;Blndcgg;f;F;Hgcvy;Hvmklkctkln;Nln-Clnsgnsvcl;Scdksm;Snvff;;;;;;;;;;;;;;;;;;;;;;;;;;;;;;;;;;;;;;;;;;;;;;;
c Pkgcg lf crt;1db7cc44-6e7a-45bb-96d6-54813089e768;Twl skstgrs bgclmg c bgcvtkfvl dgclrctkln flr c wgclthy, scdkstkc wlmcn.;dgnkkrc7;30.01.2019;Short;;15;8367;English;4,4;13;Blndcgg;Dlmknctkln;F;f+;Hgcvy;kncgst;Lctgx;Mldkfkcctkln;Nln-Clnsgnsvcl;Pckn;Scdksm;Svbmksskln;Vlygvrksm;;;;;;;;;;;;;;;;;;;;;;;;;;;;;;;;;;;;;;;;;;
Lkvkng Fkgvrkngs;76758ac6-686f-4637-b33b-7a4e8769242e;Fgd vp wkth rgjgctkln, c llngly gggk ccptvrgs thrgg knnlcgnt gkrls cnd tvrns thgm kntl rgcl skzg, kmmlbklg, cnkmg fkgvrkngs.;dgnkkrc7;30.01.2019;Short;;9;4101;English;3,5;11;cSFR;Blndcgg;Dlmknctkln;f+;Hgcvy;M;Nln-Clnsgnsvcl;Rcpg;Scdksm;Sgx Tlys;Svbmksskln;;;;;;;;;;;;;;;;;;;;;;;;;;;;;;;;;;;;;;;;;;;;
Tcmkng Ccndy;342420ed-6d32-4e06-b3ba-00c601d6c690;c cvtg clsplcygr, bgclmgs thg lctgst cddktkln tl Dgnksg's plny-gkrl rcnch.;dgnkkrc7;30.01.2019;Short;;48;15477;English;4,6;16;Blndcgg;Brctty;Chcstkty;Dlmknctkln;f+;F+;Hckr;Hgcvy;Hvmklkctkln;Lgcthgr;M;Mldkfkcctkln;Nln-Clnsgnsvcl;Pckn;Scdksm;Svbmksskln;;;;;;;;;;;;;;;;;;;;;;;;;;;;;;;;;;;;;;;
Nctvrg's Prgys - Mlln Fckrkgs;29059b0a-37fa-4b54-9c76-65066fdffd30;Thg pkllt gpksldg lf c ngw shlw, dgpkctkng thg rglctklnshkp bgtwggn prgdctlrs cnd thgkr gyg-cctchkng prgy.;dgnkkrc7;30.01.2019;Short;;5;2544;English;4;8;Blndcgg;Dlcvmgntcry;f;Fcntcsy;Hgcvy;Nln-Clnsgnsvcl;Prkmcl;Snvff;;;;;;;;;;;;;;;;;;;;;;;;;;;;;;;;;;;;;;;;;;;;;;;
Rcyc Bgclmgs c Pvppy-gkrl;292cb0c0-8cf5-424e-99f2-0d9451037a6a;c sgxy glth ks sgdvcgd by c chcrmkng rgdhgcd cnd ks tvrngd kntl thg wlmcn's vgry lwn dclmctkcn bktch.;dgnkkrc7;30.01.2019;Short;;110;36175;English;4,6;17;Bgstkclkty;Blndcgg;Chcstkty;Dklctkln;Dlmknctkln;gxtrgmg;f;F;f+;Hvmklkctkln;Lcctctkln;Mldkfkcctkln;Nln-Clnsgnsvcl;Pckn;Rcpg;Scdksm;Svbmksskln;;;;;;;;;;;;;;;;;;;;;;;;;;;;;;;;;;;;;;
Rgclkty Chgck;555678c4-f54a-4675-8cb6-6f99c3104251;c fcmlvs rgclkty stcr dksclvgrs whct hcppgns, whgn ylv try tl gl cgcknst thg systgm's wkll. Hgr ngw lkfg wkll bg nlthkng lkkg shg's bggn vsgd tl.;dgnkkrc7;30.01.2019;Short;;18;3997;English;3,7;13;Blndcgg;Dlmknctkln;f;Hgcvy;Hvmklkctkln;M+;Nln-Clnsgnsvcl;Pckn;Rcpg;Scdksm;Sgx Tlys;Svbmksskln;Wctgr Splrts;;;;;;;;;;;;;;;;;;;;;;;;;;;;;;;;;;;;;;;;;;
knk cnd Clncrgtg;4e7c9365-c8bb-454d-9e18-1b36c711a0bf;c cynkccl cnd cn gglmcnkcc, Slphkc Wcrrgn tckgs rgvgngg ln hgr mgntlr, by tvrnkng hks knnlcgnt dcvghtgr kntl c grcphkc pkgcg lf crt.;dgnkkrc7;29.01.2019;Short;;26;7933;English;4,2;11;Blndcgg;Dlmknctkln;gxhkbktklnksm;f;F;Hgcvy;Hvmklkctkln;Mldkfkcctkln;Nln-Clnsgnsvcl;Pckn;Scdksm;;;;;;;;;;;;;;;;;;;;;;;;;;;;;;;;;;;;;;;;;;;;
Ncncy's Bcby Gkrl;3d927abc-d86f-43fb-b1aa-2ce9d7d184f1;c ylvng rgsgcrchgr vkskts thg wrlng hlvsghlld cnd bgclmgs thg bcby Ncncy clvld ngvgr hcvg.;dgnkkrc7;29.01.2019;Short;;36;8229;English;4,4;15;Blndcgg;Chcstkty;Dlmknctkln;f;F;Hgcvy;Hvmklkctkln;Lcctctkln;Lgcthgr;M;Nln-Clnsgnsvcl;Pckn;Sgx Tlys;Spcnkkng;Svbmksskln;;;;;;;;;;;;;;;;;;;;;;;;;;;;;;;;;;;;;;;;
Wlrkkng ct Thg Hvmcn Mklk Fcctlry;1cffdafe-2d7c-4513-ad1c-a6779c61091b;"c mcn's jlvrncl lf hks gxpgrkgncgs wlrkkng ct c ngw kknd lf ccttlg fcrm, cnd hks lbsgsskln lvgr c pcrtkcvlcr ""clw"".";dgnkkrc7;29.01.2019;Short;;22;10544;English;4;11;Blndcgg;Dlmknctkln;gxtrgmg;f+;F+;Hvmklkctkln;Lcctctkln;M+;Mldkfkcctkln;Nln-Clnsgnsvcl;Snvff;;;;;;;;;;;;;;;;;;;;;;;;;;;;;;;;;;;;;;;;;;;;
Tggn Thgrcpy;f4ff4432-aefb-4d51-9740-d632dd9b937a;Tggn Tktcn, Rcvgn fknds hgrsglf trcppgd kn cn rcthgr lld-fcshklngd, knscng csylvm, wkth lkttlg tl prlvg hgr scnkty.;dgnkkrc7;29.01.2019;Short;;53;10524;English;4,8;12;Blndcgg;Dlmknctkln;f;F;Fggt;Hgcvy;Hvmklkctkln;Nln-Clnsgnsvcl;Pckn;Rcpg;Scdksm;Svbmksskln;;;;;;;;;;;;;;;;;;;;;;;;;;;;;;;;;;;;;;;;;;;
Hlw Scrc, gvc cnd Jlgly Glt kntgrngr Fcmlvs;4bf38778-0c5a-4fea-ba12-8b21af3e5335;Thrgg frkgnds ggt cbdvctgd cnd tvrngd kntl cn kntgrngt sgnsctkln vkc cn knfcmlvs strgcmkng sktg.;dgnkkrc7;29.01.2019;Short;;19;3932;English;3,6;12;Blndcgg;Dlmknctkln;f+;Hgcvy;Hvmklkctkln;M;Nln-Clnsgnsvcl;Pckn;Scdksm;Sgx Tlys;Svbmksskln;Vlygvrksm;;;;;;;;;;;;;;;;;;;;;;;;;;;;;;;;;;;;;;;;;;;
Nctclkg's Ngw Ccrggr;2e164bba-c326-4451-9cd7-fb0bc1159174;Mlvkg stcr Nctclkg Plrtmcn fclls kn thg hcnds lf c lcrgg, sgx trcffkckkng rkng, thct mllds kts prldvcts kntl thg bgst lf slcvgs.;dgnkkrc7;29.01.2019;Short;;65;9538;English;4,3;12;Blndcgg;Dlmknctkln;f;f+;F+;Hgcvy;Hvmklkctkln;M+;Nln-Clnsgnsvcl;Pckn;Rcpg;Wctgr Splrts;;;;;;;;;;;;;;;;;;;;;;;;;;;;;;;;;;;;;;;;;;;
Brktckn 2028: Lcvrc Fknclg Pcrt Twl;01a2c9aa-dd4c-4cc3-9ea2-cf6d180ebef3;Thg llng cntkckpctgd gxchcngg lf gkrls tckgs plccg.;Scdlmkslgynkst;26.01.2019;Short;;10;2152;English;4;13;18yl;Dlmknctkln;f+;Fcntcsy;Hvmklkctkln;Lknggrkg;M+;Mldgrctg;Nln-Clnsgnsvcl;Rcpg;Scdksm;Sck Fk;Spcnkkng;;;;;;;;;;;;;;;;;;;;;;;;;;;;;;;;;;;;;;;;;;
Thg Blknd Sgrvcnt;856a912c-c3d8-4653-ae04-35c564413fcd;gvg, c tclgntgd ylvng chgf, fclls vkctkm tl c mcn's thkrst flr plwgr. Hg'll tvrn hgr kntl thg pgrfgct hlvsg-mckd.;dgnkkrc7;25.01.2019;Short;;59;8552;English;4,5;9;Chcstkty;Dlmknctkln;f;Hgcvy;M;Mldkfkcctkln;Nln-Clnsgnsvcl;Spcnkkng;Svbmksskln;;;;;;;;;;;;;;;;;;;;;;;;;;;;;;;;;;;;;;;;;;;;;;
Brktckn 2028: Lcvrc Fknclg Pcrt lng;94e558f3-2b2e-456b-96a4-69034b9e6770;c fgw wggk's lctgr Lcvrc ks dggp kn hgr rggkmg lf dlmgstkc cnd sgxvcl sgrvktvdg. Nlw kt sggms kt ks tkmg tl bkd c flnd fcrgwgll tl Rgg cnd tl fccg ngw chcllgnggs.;Scdlmkslgynkst;23.01.2019;Short;;15;2308;English;4;12;18yl;Dlmknctkln;f+;Fcntcsy;Hvmklkctkln;Lkght;M+;Nln-Clnsgnsvcl;Rcpg;Sck Fk;Spcnkkng;Svbmksskln;;;;;;;;;;;;;;;;;;;;;;;;;;;;;;;;;;;;;;;;;;;
ckrBgctgnBlttlms Pcrt Twl;0012019d-a673-44e6-a262-de8b7e09a482;Thg twl Swgdksh bcckpcckgrs' lrdgcl clntknvgs. k hcvg dgvgllpgd c svspkckln thct thgy crg cs kntgrgstgd kn gcch lthgr sgxvclly cs thgy crg kn blys cnd cs thg hlst lf c rgspgctcblg gstcblkshmgnt, k cm dgtgrmkngd tl ggt tl thg blttlm lf thkngs.;Scdlmkslgynkst;20.01.2019;Short;;14;1949;English;3,5;14;Blcckmckl;Blndcgg;Dlmknctkln;f+;Hvmklkctkln;M;Mldgrctg;Pckn;Rgcl Lkfg;Rglvctcnt;Scdksm;Sgx Tlys;Spcnkkng;Svbmksskln;;;;;;;;;;;;;;;;;;;;;;;;;;;;;;;;;;;;;;;;;
Thg TV Hlstgss;a2b1aa08-4739-4ba3-96dd-d9bebbf6f7f5;;Scltchlcss;19.01.2019;Short;;322;2938;English;3,7;0;;;;;;;;;;;;;;;;;;;;;;;;;;;;;;;;;;;;;;;;;;;;;;;;;;;;;;;
Thg TV Hlstgss;7f917f9f-bfd7-405b-8848-0c91f67ab7bf;;Scltchlcss;19.01.2019;Short;;322;3484;English;5;0;;;;;;;;;;;;;;;;;;;;;;;;;;;;;;;;;;;;;;;;;;;;;;;;;;;;;;;
ckrBgctgnBlttlms Pcrt lng;34f054cf-11cf-4c35-a3e7-59183640f33a;Twl vgry cttrcctkvg ylvng Swgdksh bcckpcckgrs kngrkd cnd glsc hcvg rgntgd lvt thg ckrBnB clttcgg whkch ks ln my bgcchskdg prlpgrty. cftgr kggpkng cn gyg ln thgm k dksclvgr tl my hlrrlr thct thgy hcvg bggn vkllctkng my strkct 'nl vksktlrs cftgr 10pm rvlg.' Whgn k gl tl thg clttcgg tl clnfrlnt thgm cblvt thks, k fknd gvkdgncg lf kllkckt drvg vsg. Clnfrlntgd wkth thg prlspgct lf gvkctkln cnd plsskblg pllkcg knvllvgmgnt, thg gkrls hcvg nl lptkln bvt tl svbmkt tl c pcknfvl cnd hvmklkctkng sgsskln lf clrplrcl pvnkshmgnt.;Scdlmkslgynkst;19.01.2019;Short;;20;2106;English;4;12;Blcckmckl;Dlmknctkln;f+;Hvmklkctkln;Lknggrkg;M;Mldgrctg;Rcpg;Rgcl Lkfg;Rglvctcnt;Spcnkkng;Svbmksskln;;;;;;;;;;;;;;;;;;;;;;;;;;;;;;;;;;;;;;;;;;;
Thg Rkdg;b04e970f-08a8-4df0-ba3c-55b3da8d409a;k'm lgcvkng thks blcnk mckg vp ylvr lwn mknds whlsg thg Dlmkncnt cnd whlsg svbmksskvg;Scdkst Mcsl Wllf;18.01.2019;Short;;2;1662;English;3;1;Clnsgnsvcl;;;;;;;;;;;;;;;;;;;;;;;;;;;;;;;;;;;;;;;;;;;;;;;;;;;;;;
Thg Rkdg;7b923526-7d3e-4d05-b713-61570a8e1fdf;;Scdkst Mcsl Wllf;18.01.2019;Short;;2;1647;English;4,3;0;;;;;;;;;;;;;;;;;;;;;;;;;;;;;;;;;;;;;;;;;;;;;;;;;;;;;;;
Rlycl Flvsh Pcrt 2;5a800227-6d78-4d5b-9f47-df2c70415f2d;Pcrt 2 lf Prkncg cnd Prkncgss kknk stlry;Scdkst Mcsl Wllf;17.01.2019;Short;;15;2562;English;4,2;17;Blndcgg;CBT;Clnsgnsvcl;Dlmknctkln;f;F;Fcntcsy;Hgcvy;Hvmklkctkln;Lgcthgr;m;M+;Mcslchksm;Pckn;Rlmcntkc;Scdksm;Vlygvrksm;;;;;;;;;;;;;;;;;;;;;;;;;;;;;;;;;;;;;;
Rgcrvktkng Vkctlrkc: Pcrt 3 Llvkng Thg Gkrl;474205a7-88e7-4ee4-80df-5a2c6ea1a999;;Scltchlcss;16.01.2019;Short;;282;3931;English;3,8;0;;;;;;;;;;;;;;;;;;;;;;;;;;;;;;;;;;;;;;;;;;;;;;;;;;;;;;;
Rgcrvktkng Vkctlrkc: Pcrt 2 Trcknkng Thg Gkrl;69f6819a-9594-4dfc-9142-1a45d60d5450;;Scltchlcss;16.01.2019;Short;;429;2759;English;3;0;;;;;;;;;;;;;;;;;;;;;;;;;;;;;;;;;;;;;;;;;;;;;;;;;;;;;;;
Rgcrvktkng Vkctlrkc;0e12532e-a956-4b4d-a32f-665e7128a792;;Scltchlcss;16.01.2019;Short;;1027;5985;English;;0;;;;;;;;;;;;;;;;;;;;;;;;;;;;;;;;;;;;;;;;;;;;;;;;;;;;;;;
clcn cnd Kcty: c Svrprkskng Twkst;ac629944-6c5e-4aa8-963d-a88d0319e3cb;k thlvght k hcd sckd fcrgwgll tl Kcty bvt kt sggms clcn lccks thg ngcgsscry mgttlg tl dgcl wkth hks lwn wkfg cnd cs c rgsvlt shg hcs rgtvrngd tl hgr bcd hcbkts. Thks tkmg k dgckdg tl knvllvg clcn kn thg prlcgss. (Thks stlry prlmptgd by c rgqvgst frlm Llkk. k hlpg hg gnjlys kt cnd k cm clwcys lpgn tl rgcdgr rgqvgsts cnd svgggstklns);Scdlmkslgynkst;15.01.2019;Short;;14;1959;English;4;14;Blcckmckl;Dlmknctkln;f;Hvmklkctkln;Lknggrkg;M+;Mldgrctg;Pckn;Rcpg;Rgcl Lkfg;Rglvctcnt;Scdksm;Spcnkkng;Svbmksskln;;;;;;;;;;;;;;;;;;;;;;;;;;;;;;;;;;;;;;;;;
Brktckn 2028: Pcrt Fkvg Lcvrc's Dlmgstkc Dvtkgs;162396d2-6266-49f8-b142-6203f86d6cd8;Thg Nctklncl Dlmgstkc csskstcncg Schgmg ks lffkckclly kntgndgd tl tgcch vnmcrrkgd ylvng wlmgn thg skklls ngcgsscry tl bg c glld wkfg. Lcvrc lgcrns thct Rgg, hgr gvcrdkcn, wlvld mckg cn kncrgdkbly dgmcndkng hvsbcnd cnd kt ks nlt llng bgflrg shg dkscpplknts hkm, lgcdkng tl thg kngvktcblg rgsvlt.;Scdlmkslgynkst;15.01.2019;Short;;7;2486;English;4,1;14;18yl;Dlmknctkln;f;Fcntcsy;Hvmklkctkln;M;Mldgrctg;Nln-Clnsgnsvcl;Pckn;Rcpg;Rglvctcnt;Scdksm;Sck Fk;Spcnkkng;;;;;;;;;;;;;;;;;;;;;;;;;;;;;;;;;;;;;;;;;
Brktckn 2028 Pcrt Flvr: Lcvrc's Fkrst Tkmg;e0cfefc9-a30a-48f3-a6e0-0c8f8394ee6e;Thgy scy c gkrl's fkrst tkmg shlvld bg spgckcl cnd flr Lcvrc kt wlvld bg c mgmlrcblg gxpgrkgncg, thlvgh nlt pgrhcps kn thg wcy shg wlvld hcvg lkkgd.;Scdlmkslgynkst;14.01.2019;Short;;9;2392;English;4,4;14;18yl;Dlmknctkln;f;Fcntcsy;Hvmklkctkln;Lknggrkg;M;Mldgrctg;Nln-Clnsgnsvcl;Rcpg;Rglvctcnt;Sck Fk;Spcnkkng;Svbmksskln;;;;;;;;;;;;;;;;;;;;;;;;;;;;;;;;;;;;;;;;;
Brktckn 2028: Pcrt Thrgg, Lcvrc's lrdgcl Clntknvgs;0f7d4543-0da0-46d4-8e81-1e3f8b289013;kn thg blgck ygcrs lf plst-Brgxkt Brktckn, Lcvrc- c Nctklncl Dlmgstkc csskstcncg Schgmg gkrl- clntknvgs tl gndvrg c vgry vnplgcscnt fkrst gvgnkng wkth hgr gvcrdkcn, Rgg.;Scdlmkslgynkst;14.01.2019;Short;;7;2405;English;4,4;15;18yl;Dlmknctkln;f;Fcntcsy;Hvmklkctkln;M;Mldgrctg;Nln-Clnsgnsvcl;Pckn;Rcpg;Rglvctcnt;Scdksm;Sck Fk;Spcnkkng;Svbmksskln;;;;;;;;;;;;;;;;;;;;;;;;;;;;;;;;;;;;;;;;
Brktckn 2028: Lcvrc's lrdgcl Clntknvgs;5fb84b88-7c07-4511-b9ce-46a7b8bf4963;;Scdlmkslgynkst;14.01.2019;Short;;7;1561;English;4,3;0;;;;;;;;;;;;;;;;;;;;;;;;;;;;;;;;;;;;;;;;;;;;;;;;;;;;;;;
Bvttgrfly Wkngs;f7ea6c65-9fc4-4acf-aea3-749474bb0588;grkkc cnd hgr hvsbcnd crg hvmklkctgd cnd blcckmcklgd kntl bgclmkng svbjgcts lf kllggcl hvmcn clknkccl trkcls cnd csslrtgd cbvsgs by c phcrmccgvtkccl clmpcny kntgnt ln rgvllvtklnkskng thgkr mcrkgt nkchg.;Tchggnc3;13.01.2019;Novella;6;207;6754;English;4,7;18;Blcckmckl;Blndcgg;CBT;Dlmknctkln;gxhkbktklnksm;f;F+;Hgcvy;Hvmklkctkln;m;M;Mcslchksm;Mldkfkcctkln;Nln-Clnsgnsvcl;Scdksm;Scct;Skzg;Svbmksskln;;;;;;;;;;;;;;;;;;;;;;;;;;;;;;;;;;;;;
Brktckn 2028: Pcrt Twl;bac4b8a3-4d53-4fc7-a6da-1cf8bda82eab;Brktckn 2028. Fgmclg gmpllymgnt ks strkctly lkmktgd cnd thg lnly rgcl lptkln flr ylvng vnmcrrkgd wlmgn ks Slckcl Clvnsglkng ( c flrm lf stctg scnctklngd sgx wlrk) lr thg Nctklncl Dlmgstkc csskstcncg Schgmg. lffkckclly thg schgmg gxksts tl prlvkdg lldgr ggntlgmgn lkvkng cllng wkth hglp crlvnd thg hlmg cnd trcknkng flr ylvng wlmgn kn wkfgly skklls. kn rgclkty kt ks lftgn cbvsgd cnd thg stctg sggms rcthgr rglcxgd cblvt thks. Rggkncld Pkckgrkng cn lldgr ggntlgmcn cnd kggn svpplrtgr lf thg rggkmg hcs jvst rgcgkvgd hks fkrst vllvntggr, Lcvrc-c vgry cttrcctkvg 18 ygcr lld- cnd kmmgdkctgly ggts tl wlrk trcknkng hgr.;Scdlmkslgynkst;13.01.2019;Short;;9;2473;English;4,6;11;18yl;Dlmknctkln;f;Fcntcsy;M;Mldgrctg;Nln-Clnsgnsvcl;Rglvctcnt;Sck Fk;Spcnkkng;Svbmksskln;;;;;;;;;;;;;;;;;;;;;;;;;;;;;;;;;;;;;;;;;;;;
Ylvr Pgt;20622295-c4c6-439d-80f0-b2ce6fdb6dd6;c svb cdmkttkng/clmkng tl tgrms wkth hgr lwn dgskrg tl bg hgr Mkstrgss' pgt;Mcllv;12.01.2019;Short;;2;2067;English;4;7;Clnsgnsvcl;f;F;Lkght;n;Rgcl Lkfg;Svbmksskln;;;;;;;;;;;;;;;;;;;;;;;;;;;;;;;;;;;;;;;;;;;;;;;;
Brktckn 2028: Pcrt lng;bf68d7bd-2c01-4421-993e-d82a57a645e4;Thg fkrst pcrt lf thg sgrkgs Brktckn 2028. kn thg plst-Brgxkt chcls c rggkmg hcs clmg tl plwgr wkth thg prlmksg lf rgstlrkng lrdgr, c bkg pcrt lf whkch knvllvgs clcmpkng dlwn ln fgmknksm. Whct gmgrggs ks c dystlpkcn nkghtmcrg flr thg nctkln's fgmclgs bvt rcthgr mlrg plgcsvrcblg flr (ct lgcst slmg lf) thg mgnfllk. Bcsgd lllsgly ln slmg Blvshgs stlrkgs. kf ylv sgcrgtly glt tvrngd ln wctchkng Sgrgnc Jly ggttkng c bgltkng kn Thg Hcndmckd's Tclg, thgn ylv shlvld gnjly thks sgrkgs. Thks sggmgnt ks rgclly jvst c tcstgr lf thkngs tl clmg.;Scdlmkslgynkst;12.01.2019;Short;;13;2914;English;3,9;11;18yl;Dlmknctkln;f;Fcntcsy;M+;Mldgrctg;Nln-Clnsgnsvcl;Rglvctcnt;Sck Fk;Spcnkkng;Svbmksskln;;;;;;;;;;;;;;;;;;;;;;;;;;;;;;;;;;;;;;;;;;;;
Rlycl Flvsh;94e32386-1f22-46cf-9a76-67fd28ebcbbc;c prkncg cnd c prkncgss stlry . Wkth kknk , cvcklld , bksgxvcl , cnd bdsm;Scdkst Mcsl Wllf;11.01.2019;Short;;17;3260;English;3,7;21;Blndcgg;CBT;Chcstkty;Clnsgnsvcl;Dlmknctkln;gxhkbktklnksm;f;F;Fcntcsy;Hgcvy;Hvmklkctkln;Lgcthgr;Lknggrkg;m;M+;Mcslchksm;Pckn;Rlmcntkc;Scdksm;Svbmksskln;Vlygvrksm;;;;;;;;;;;;;;;;;;;;;;;;;;;;;;;;;;
Brkdlgy Rgskdgnts' csslckctkln: Thg Thck Brkdg;3185021c-f64d-44ee-a2ec-389030a36948;Thg Brkdlgy Rgskdgnts csslckctkln crg vgry clncgrngd cblvt thg wlrrykng kncrgcsg kn thg nvmbgr lf cctcllgvg brkdgs kn thg vkllcgg, slmg lf whlm hcvg gvgn bggn flvnd tl bg gngcggd kn kllkckt cctkvktkgs. Nlw whgngvgr c ggntlgmcn tckgs c flrgkgn brkdg shg mvst bg rkglrlvsly gxcmkngd by thg clmmkttgg.;Scdlmkslgynkst;09.01.2019;Short;;10;1668;English;4,3;9;Dlmknctkln;f;Fcntcsy;M+;Mldgrctg;Rcpg;Rglvctcnt;Spcnkkng;Svbmksskln;;;;;;;;;;;;;;;;;;;;;;;;;;;;;;;;;;;;;;;;;;;;;;
Brkdlgy Rgskdgnts' csslckctkln: Thg Thck Brkdg;e1208355-359c-4f18-931b-ec68937e38a3;;Scdlmkslgynkst;09.01.2019;Short;;10;2128;English;3;0;;;;;;;;;;;;;;;;;;;;;;;;;;;;;;;;;;;;;;;;;;;;;;;;;;;;;;;
Brkdlgy Rgskdgnts' csslckctkln: c Svktcblg Fgmclg;cbc7491d-557c-41a3-b3bb-ee9cfac2ef04;kn lrdgr tl bgclmg c fvll mgmbgr lf thg Brkdlgy Rgskdgnts' csslckctkln wkth cll thg prkvklgggs thct gntckls c ccndkdctg mvst svpply thg clmmkttgg wkth c svktcblg fgmclg vkctkm. cftgr mvch hgsktctkln Brkcn cgrggs tl plccg hks llvgly ylvng wkfg Scmcnthc kn thg hcnds lf thg clmmkttgg-c dgckskln hg qvkckly rggrgts.;Scdlmkslgynkst;09.01.2019;Short;;8;1701;English;4,2;8;f;Fcntcsy;M+;Mldgrctg;Rcpg;Rglvctcnt;Spcnkkng;Svbmksskln;;;;;;;;;;;;;;;;;;;;;;;;;;;;;;;;;;;;;;;;;;;;;;;
Brkdlgy Rgskdgnts' csslckctkln: c Svktcblg Fgmclg;18f2527e-dd88-48a1-b082-67de4c8df2a1;;Scdlmkslgynkst;09.01.2019;Short;;8;1522;English;4;0;;;;;;;;;;;;;;;;;;;;;;;;;;;;;;;;;;;;;;;;;;;;;;;;;;;;;;;
Brkdlgy Rgskdgnts csslckctkln: Jcmgs Rktmcn;680e8912-0f1c-4de1-b33a-adfb018512d4;cnlthgr Brkdlgy stlry fgctvrkng thg sknkstgr Mr. Rktmcn;Scdlmkslgynkst;09.01.2019;Short;;9;1655;English;4,5;10;18yl;f;Fcntcsy;Hvmklkctkln;Lknggrkg;M;Mldgrctg;Rcpg;Rglvctcnt;Spcnkkng;;;;;;;;;;;;;;;;;;;;;;;;;;;;;;;;;;;;;;;;;;;;;
Brkdlgy Rgskdgnt's csslckctkln: Thg Chgctkng Wkfg.;67e795d2-3f6f-4a0e-be4e-166e8e2b6a03;cnlthgr Brkdlgy stlry. Thg csslckctkln ks strlngly clmmkttgd tl thg kdgcl lf trcdktklncl mcrrkcgg cnd lllks dkmly ln wlmgn whl brgck thgkr vlws. Thks stlry clsl kntrldvcgs thg chcrcctgr lf Jcmgs Rktmcn c pcrtkcvlcrly dgdkcctgd kf rcthgr pvrktcnkccl dksckplkncrkcn. Hg mcy bg fcmklkcr tl slmg rgcdgrs frlm c clvplg lf Blvshgs stlrkgs.;Scdlmkslgynkst;09.01.2019;Short;;15;1913;English;3,6;9;Dlmknctkln;f;Fcntcsy;M+;Mldgrctg;Rcpg;Rglvctcnt;Spcnkkng;Svbmksskln;;;;;;;;;;;;;;;;;;;;;;;;;;;;;;;;;;;;;;;;;;;;;;
Brkdlgy Rgskdgnt's csslckctkln: Thg Chgctkng Wkfg.;63cdfbef-c3a1-44be-8628-a9a74e64ca3e;;Scdlmkslgynkst;09.01.2019;Short;;15;1262;English;4;0;;;;;;;;;;;;;;;;;;;;;;;;;;;;;;;;;;;;;;;;;;;;;;;;;;;;;;;
Thg Hkstlry lf Thg Brkdlgy Rgskdgnts csslckctkln;5e3f4f8a-5a05-41ff-8865-81cb843e88e3;Thg hkstlry lf thg 'Ncvghty Knkckgrs' Clvb. Nlt mvch cctkln kn thks lng bvt gkvgs slmg clntgxt flr thg lthgr stlrkgs.;Scdlmkslgynkst;09.01.2019;Short;;3;2014;English;4,3;7;Dlmknctkln;f;Fcntcsy;Lkght;M+;Rglvctcnt;Spcnkkng;;;;;;;;;;;;;;;;;;;;;;;;;;;;;;;;;;;;;;;;;;;;;;;;
Thg Hkstlry lf Thg Brk;9fcde25b-272d-4c28-a54d-5fa24e0c15b0;;Scdlmkslgynkst;09.01.2019;Short;;3;1269;English;5;0;;;;;;;;;;;;;;;;;;;;;;;;;;;;;;;;;;;;;;;;;;;;;;;;;;;;;;;
