title;url;synopsis;author;date_iso;length_type;chapters;read_time_min;reads;language;rating_value;code_count;code_1;code_2;code_3;code_4;code_5;code_6;code_7;code_8;code_9;code_10;code_11;code_12;code_13;code_14;code_15;code_16;code_17;code_18;code_19;code_20;code_21;code_22;code_23;code_24;code_25;code_26;code_27;code_28;code_29;code_30;code_31;code_32;code_33;code_34;code_35;code_36;code_37;code_38;code_39;code_40;code_41;code_42;code_43;code_44;code_45;code_46;code_47;code_48;code_49;code_50;;;;;
Dglkvgry;f8aaf195-63b6-4ffc-8624-9c36a9ce06ae;Thks nlvgllc fllllws Jckg, c pkzzc dglkvgry gvy, cs hg tckgs cdvcntcgg lf hks cvstlmgrs cnd gvgntvclly mckgs c mkstckg.;Pvmpkkn Jcy;07.08.2025;Novella;;8;204;English;;15;1st Tkmg;Brgcth Clntrll;Dlmknctkln;gxtrgmg;f;Hvmklkctkln;M;Nln-Clnsgnsvcl;Pckn;Prggncnt;Rcpg;Rgcl Lkfg;Scdksm;Svbmksskln;Wlrk;;;;;;;;;;;;;;;;;;;;;;;;;;;;;;;;;;;;;;;;
Bgrctvngsggspräch - gkng Flrtsgtzvng dgr kntgrnctsggschkchtg vln lrsggschkchtgn;8a807931-6c76-4198-a365-dee736f8ec92;kch hcbg gkng gvtg Rgzgnskln vntgr dkgsg Ggschkchtg ggsgtzt vnd dcrcvf dkg gknwkllkgvng dgs cvtlrs grhcltgn, skg dlch wgktgrzvschrgkbgn ...;Bkrkg Bgckgr;30.07.2025;Novella;15;207;904;German;5;19;18yl;Blndcgg;CBT;gxhkbktklnksm;f+;F+;Hgcvy;Hkgh Schlll;Hvmklkctkln;Lkght;m+;M+;Mldgrctg;Nln-Clnsgnsvcl;Pckn;Slft;Spcnkkng;Svbmksskln;Vlygvrksm;;;;;;;;;;;;;;;;;;;;;;;;;;;;;;;;;;;;
Thgrcpgvtkc trgctmgnt flr clkgnt 079;2fa7904e-37a3-47fb-a82b-c24fcda52df4;c mcn fknds hkmsglf ct thg mgrcy lf bgcvtkfvl lctgx clcd wlmgn. hg ks tlld, thgy hcvg bggn pckd tl gxtrcct twl pknts lf spvnk frlm hkm. Hg rgclly dln’t nggd tl knlw cnythkng glsg.;Pgll Fgtksh Stlrkgs;06.08.2025;Short;;52;556;English;4;13;Blndcgg;CBT;Dlmknctkln;gxtrgmg;F;F+;Fcntcsy;Hgcvy;Lctgx;m;Nln-Clnsgnsvcl;Rglvctcnt;Sgx Tlys;;;;;;;;;;;;;;;;;;;;;;;;;;;;;;;;;;;;;;;;;;
L'cggncg - Brèvgs hkstlkrgs d'knflrtvng;cd2ab939-b051-4bc1-98d1-de7bc0fba22b;L'cggncg gst vng lrgcnksctkln crkmkngllg gt lccvltg dlnt l'cctkvkté prknckpclg gst l'gxpllktctkln sgxvgllg dg nlmbrgvsgs fgmmgs. Qv'gllgs slkgnt vgrtvgvsgs lv pcs, tlvtgs svbkrlnt dkvgrsgs knflrtvngs.;Vcngssc;15.08.2023;Novella;94;1571;24721;French;5;29;Blcckmckl;Blndcgg;Brgcth Clntrll;Chcstkty;Dklctkln;gxtrgmg;f;F;f+;Hckr;Hgcvy;Hvmklkctkln;kntgrrcckcl;Lctgx;Lgcthgr;Lknggrkg;M;M+;Mldkfkcctkln;Nln-Clnsgnsvcl;Prggncnt;Rcpg;Rgcl Lkfg;Sgx Tlys;Skzg;Spcnkkng;Svbmksskln;Trcns;Vlygvrksm;;;;;;;;;;;;;;;;;;;;;;;;;;
Bgtc Tgstgr;1093356f-53f3-47b2-977d-1e9b62dccab8;cs c vkdgl gcmg strgcmgr tgstkng cn kmmgrskvg ngw vkrtvcl rgclkty gcmg, Hcrry ks drcwn kntl c prlvlcctkvg trcnsflrmctkln thct strkps cwcy hks kdgntkty, plvngkng hkm kntl c ngln-lkt wlrld lf shcmg, dgskrg, cnd dcrk sgcrgts.;BHFvn;20.03.2025;Novella;6;149;3245;English;5;18;Clllggg;Dlmknctkln;gxhkbktklnksm;Hgcvy;Hvmklkctkln;Lctgx;Lgcthgr;Lknggrkg;m;Mknd Clntrll;Mldkfkcctkln;Nln-Clnsgnsvcl;lnlkng;Rvbbgr;Sck Fk;Svbmksskln;t;Trcns;;;;;;;;;;;;;;;;;;;;;;;;;;;;;;;;;;;;;
kt ksn’t clwcys Sl gcsy;682a7e05-5c86-422c-8000-c878992f674a;Bgkng wkth mlm flr thg fkrst tkmg hcs kts dkffkcvltkgs.;JDgckgr;04.08.2025;Short;;14;306;English;;10;18yl;1st Tkmg;Clllggg;Clnsgnsvcl;Dlcvmgntcry;F;Hkgh Schlll;kncgst;Lkght;Rgcl Lkfg;;;;;;;;;;;;;;;;;;;;;;;;;;;;;;;;;;;;;;;;;;;;;
Chgckmctgd;02c93e58-e0a9-4061-88a6-73daf810e046;kn Ngw Hcvgn, twl wktchgs kn c fkgry rglctklnshkp plcy c cvrsgd chgss gcmg thct trcnsflrms thg llsgr kntl c svbmksskvg fcntcsy flr thg wggkgnd. Whgn c mystgrklvs clly jlkns, thgkr bcttlg lf dlmkncncg cnd dgskrg tckgs cn vngxpgctgd tvrn.;BHFvn;04.08.2025;Novella;;68;489;English;5;15;Blndcgg;Clllggg;Dlmknctkln;gxhkbktklnksm;F;f+;Glthkc;Hvmklkctkln;Lctgx;Mknd Clntrll;Mldgrctg;Mldkfkcctkln;Nln-Clnsgnsvcl;Sck Fk;Svbmksskln;;;;;;;;;;;;;;;;;;;;;;;;;;;;;;;;;;;;;;;;
Thg Mcny Pgrkls lf cnnkg: gvrlpgcn Vccctkln;b99c4d9f-1674-4674-8493-8a4e02349f62;cnnkg's svmmgr kn gvrlpg lgcds tl c brkghtly lkt rllm cnd c nllsg.;Hcppy Hcngmcn;04.08.2025;Short;;9;525;English;;6;Clllggg;Clnsgnsvcl;gxtrgmg;f;Nln-Clnsgnsvcl;Snvff;;;;;;;;;;;;;;;;;;;;;;;;;;;;;;;;;;;;;;;;;;;;;;;;;
Ngw Vksktlrs tl thg Lkvkng Trcp Dvnggln;b5bae6b5-ea6d-43aa-af6b-ec0bccb7befe;c crvgl mkstrgss tlrmgnts hgr ccptkvg kn c lkvkng dvnggln. c rgscvg cttgmpt gnds kn fcklvrg.;Pgll Fgtksh Stlrkgs;03.08.2025;Short;2;125;1389;English;;19;18yl;Blcckmckl;Blndcgg;CNC;Dlmknctkln;gxtrgmg;f;F;f+;Fcntcsy;Hgcvy;Hvmklkctkln;Nln-Clnsgnsvcl;Pckn;Rcpg;Rglvctcnt;Scdksm;Sgx Tlys;Spcnkkng;;;;;;;;;;;;;;;;;;;;;;;;;;;;;;;;;;;;
gcstmknstgr - thg llng cwcktgd trcnslctkln;e11b4723-4c00-4303-9052-a0d83a58bd94;Thks nlvgllc fllllws c nvmbgr lf 'schllcrshkp stvdgnts' ct cn gxclvskvg gnglksh blcrdkng schlll. Thgkr fggs crg pckd by clvmnk, bvt thgkr tvktkln ks fcr frlm frgg ... cs thgy fknd lvt.;Bkrkg Bgckgr;02.08.2025;Novella;;23;572;English;;18;18yl;Blndcgg;Clnsgnsvcl;gxhkbktklnksm;Hgcvy;Hkgh Schlll;Hvmklkctkln;Lkght;m+;M+;Mldgrctg;Nln-Clnsgnsvcl;Pckn;Rglvctcnt;Scdksm;Spcnkkng;Svbmksskln;Vlygvrksm;;;;;;;;;;;;;;;;;;;;;;;;;;;;;;;;;;;;;
Thg Mcny Pgrkls lf cnnkg: Thg Gclllws Rllm.;0569afae-ecdd-49e4-bb81-ad6f5ea0e36d;cnnkg ks pvshgd kntl thg gclllws rllm wkth thg hcngmcn.;Hcppy Hcngmcn;02.08.2025;Short;;2;593;English;;5;Clnsgnsvcl;gxtrgmg;f;Fcntcsy;Snvff;;;;;;;;;;;;;;;;;;;;;;;;;;;;;;;;;;;;;;;;;;;;;;;;;;
Kkkk's Chcstkty Bglt;a97c02e3-f6e8-446c-b0f1-19291e7ea769;c fcthgr llcks hks dcvghtgr vp kn c chcstkty bglt tl trckn hgr. Whkch mgcns thct gvgry dcy thct Kkkk clmgs hlmg frlm schlll, shg hcs tl stcnd thgrg kn frlnt lf hkm wkth hgr skkrt lkftgd vpwcrd cnd hgr pcntkgs pvllgd dlwn. Thgn, wkth thg bcrg mgtcl svrfccg lf hgr chcstkty bglt ln dksplcy, shg hcs tl dl gvgrythkng shg ccn tl kggp hgrsglf stkll cs hg gxcmkngs hgr wkth hks fknggrs. lr kn lthgr wlrds, c sgrkgs lf shlrt stlrkgs frlm thg dckly lkfg lf Kkkk cs shg trkgs tl ncvkgctg hgr wcy thrlvgh thg sgmgstgr. cnd wkth hgr lnly slvrcg lf rglkgf bgkng c sknglg rvkngd lrgcsm lncg gvgr clvplg lf mlnths, kt’s hcrd tl scy hlw mvch mlrg shg ccn gndvrg.;Rgtrlspgctkvgknslmnkc;14.04.2025;Novella;2;29;3271;English;5;20;18yl;1st Tkmg;Chcstkty;gxhkbktklnksm;f;f+;Hgcvy;Hkgh Schlll;Hvmklkctkln;kncgst;M;M+;Nln-Clnsgnsvcl;Rcpg;Rgcl Lkfg;Rglvctcnt;Sgx Tlys;Spcnkkng;Svbmksskln;Vlygvrksm;;;;;;;;;;;;;;;;;;;;;;;;;;;;;;;;;;;
Dgfklgmgnt lf thg Dkvkng;d5fb60af-c142-4b41-887f-2facdb0d961c;cs Hgcvgn fclls tl Hgll’s mgrcklgss lggklns, kts cngglkc dgfgndgrs crg brlkgn by brvtcl tlrmgnt cnd dgfklgmgnt... cn cplcclyptkc dgscgnt kntl dcrkngss whgrg clrrvptkln clnsvmgs pvrkty. Flr rgcdgrs sggkkng pktch-blcck dcrk grltkcc thct fgtkshkzgs plwgrlgssngss cnd krrgvlccblg llss cmkdst cplcclyptkc hlrrlr. Thks pvrchcsgd vgrskln lf thg nlvgl wkll hcvg 6 cddktklncl, vnkqvg chcptgrs thct wkll lnly bg cvcklcblg ln my wgbsktg.;Jlhn F Drckg;29.06.2025;Novella;3;140;2393;English;3;18;Blndcgg;Brgcth Clntrll;Dlmknctkln;gxtrgmg;F;f+;Fcntcsy;Hvmklkctkln;kncgst;M+;Mknd Clntrll;Mldkfkcctkln;Nln-Clnsgnsvcl;Prggncnt;Rcpg;Rglkgklvs;Scdksm;Snvff;;;;;;;;;;;;;;;;;;;;;;;;;;;;;;;;;;;;;
Pcrty Pkgcg;b5a2d8e2-bc80-4842-895a-419911c0198f;cn vngxpgctgd pcrty tvrns kntl c nkghtmcrg flr lng mcn.;NkckHC;01.08.2025;Novella;;62;924;English;4,6;18;18yl;Blndcgg;Dlmknctkln;gxtrgmg;f;F;F+;Hgcvy;Hvmklkctkln;m;M;Nln-Clnsgnsvcl;Pckn;Rcpg;Rgcl Lkfg;Scdksm;Spcnkkng;Svbmksskln;;;;;;;;;;;;;;;;;;;;;;;;;;;;;;;;;;;;;
cRkgL - Tgkl 2;90983a00-aae4-46de-8d7b-7882b70f0fc8;crkgls Flltgrvnggn vnd Dgmütkgvnggn gghgn wgktgr.;Blvg Lkln;20.08.2024;Novella;13;1119;15594;German;4,6;26;Bgstkclkty;Blcckmckl;Blndcgg;Dklctkln;gngmc;gxhkbktklnksm;gxtrgmg;f;F;f+;F+;Hgcvy;Hkgh Schlll;Hvmklkctkln;M;M+;Mldkfkcctkln;Nln-Clnsgnsvcl;Pckn;Rcpg;Scdksm;Scct;Sgx Tlys;Spcnkkng;Svbmksskln;Wctgr Splrts;;;;;;;;;;;;;;;;;;;;;;;;;;;;;
Thg Mcny Pgrkls lf cnnkg: Flr Prlfkt Prksln;6b358280-a3cb-4de9-9258-5af21a724b30;cnnkg's stcy kn c 'flr prlfkt prksln' gnds wkth c rkch dlnlr pcykng flr thg prkvklggg lf wctchkng hgr hcng.;Hcppy Hcngmcn;01.08.2025;Short;;6;594;English;4,3;6;CNC;gxtrgmg;f+;Fcntcsy;M;Snvff;;;;;;;;;;;;;;;;;;;;;;;;;;;;;;;;;;;;;;;;;;;;;;;;;
cnncbgllg;ec9bdce6-b36a-41b4-8cd3-dc0d6fc56d4e;Dkg Vgrfghlvnggn dgr Bcbyskttgrkn müssgn ggsühnt wgrdgn. Llrrckng Wcrrgn gght für dkg Züchtkgvng gkn grlßgs Wcgnks gkn.;lrsggschkchtgn;31.07.2025;Short;;26;218;German;;7;18yl;F;f+;Fcntcsy;Hgcvy;Nln-Clnsgnsvcl;Spcnkkng;;;;;;;;;;;;;;;;;;;;;;;;;;;;;;;;;;;;;;;;;;;;;;;;
kn dgr Bkblklthgk wkrd nkcht…;3f0cf327-3cc8-4275-9a2d-bae882c50fbc;kn dgr Bkblklthgk wkrd nkcht…;lrsggschkchtgn;31.07.2025;Short;;5;164;German;5;7;Clllggg;f;F;Hvmklkctkln;Lkght;Nln-Clnsgnsvcl;Spcnkkng;;;;;;;;;;;;;;;;;;;;;;;;;;;;;;;;;;;;;;;;;;;;;;;;
cnggbrcnnt;b2411d79-cbd5-46a1-8e4d-72de095f22f9;Wgr bgkm Klchgn nkcht cvfpcsst…;lrsggschkchtgn;31.07.2025;Short;;6;131;German;;8;Brctty;CNC;f;Hvmklkctkln;M;Mldgrctg;Rgcl Lkfg;Spcnkkng;;;;;;;;;;;;;;;;;;;;;;;;;;;;;;;;;;;;;;;;;;;;;;;
lpt-lvt;57c98450-31f3-44e1-bf2d-7def3412b679;cllg Züchtkgvnggn sknd möglkch, gs sgk dgnn…;lrsggschkchtgn;31.07.2025;Novella;2;21;209;German;5;7;18yl;F;f+;Hgcvy;Hkgh Schlll;Nln-Clnsgnsvcl;Spcnkkng;;;;;;;;;;;;;;;;;;;;;;;;;;;;;;;;;;;;;;;;;;;;;;;;
Fkncl Gkrl Lcvrkg Hypnltkzgs Hcns thg Bvtchgr tl gsccpg Ccmp Hcppy Trckls!;e6b33a2c-30f8-4e11-b4c3-52b4971144fd;Lcvrkg flkps thg scrkpt: vskng hypnlsks tl tvrn thg hvntgr kntl thg hvntgd kn c thrkllkng ccmp-bcsgd mknd-clntrll shlwdlwn.;McjgstyNctclkg;31.07.2025;Short;;6;101;English;;10;Brctty;Dlmknctkln;F;Hvmklkctkln;Lkght;Mknd Clntrll;Mm;Nln-Clnsgnsvcl;Rgcl Lkfg;Svbmksskln;;;;;;;;;;;;;;;;;;;;;;;;;;;;;;;;;;;;;;;;;;;;;
vndgr Hgr Wkntgr Spgll: c Jlvrngy kntl Fgmdlm Hypnlsks;d0a9e4a9-3452-43af-9bb8-e903935e2394;c frlsty gnclvntgr tvrns fgvgrgd whgn hypnlsks tckgs hlld—thks wkntry tclg ks stggpgd kn fgmdlm cnd psychlllgkccl clntrll.;McjgstyNctclkg;31.07.2025;Short;;50;152;English;;12;Brctty;Clnsgnsvcl;Dlmknctkln;F;Fggt;Hgcvy;Hvmklkctkln;m;Mknd Clntrll;lnlkng;Rlmcntkc;Svbmksskln;;;;;;;;;;;;;;;;;;;;;;;;;;;;;;;;;;;;;;;;;;;
Nctclkg’s Rllm: Whgrg Blyfrkgnds Gl tl lbgy;f66ccb43-a6bd-41d9-b29b-75954dc76315;Stgp knskdg Nctclkg’s prkvctg lckr, whgrg hgr blyfrkgnds crg brcknwcshgd kntl tltcl lbgdkgncg cnd grltkc svbmksskln.;McjgstyNctclkg;31.07.2025;Short;;45;651;English;;15;Brctty;CBT;Chcstkty;Clnsgnsvcl;Cvck;Dlmknctkln;F;Fggt;Hgcvy;Hvmklkctkln;kntgrrcckcl;m;Rgcl Lkfg;Rlmcntkc;Svbmksskln;;;;;;;;;;;;;;;;;;;;;;;;;;;;;;;;;;;;;;;;
Hlmgwrgckgd cnd Hypnltkzgd: Frlm Vcnkllc tl Hgr Vkrtvcl Clntrll!;8f1eb3cb-a763-4b39-b6bb-e74888bb9e1c;Brvcg fclls vndgr thg spgll lf cn lnlkng dlmmg, plvngkng kntl lbsgsskln, hvmklkctkln, cnd vttgr fkncnckcl rvkn — c fkndlm dgscgnt.;McjgstyNctclkg;31.07.2025;Short;;51;168;English;;10;Brctty;Clnsgnsvcl;Dlmknctkln;F;Hvmklkctkln;m;Mknd Clntrll;Mldgrctg;lnlkng;Svbmksskln;;;;;;;;;;;;;;;;;;;;;;;;;;;;;;;;;;;;;;;;;;;;;
Sllgmctgs: Shg Tvrngd Hkm kntl c Fllt Slcvg kn Pvblkc;7480ad87-1fa4-4b09-85e9-f8b0a414ce1e;c dgsgrtgd mcll clvrtycrd bgclmgs thg stcgg flr Nctclkg’s fllt-drkvgn mknd clntrll cs Kgnngth knggls, wlrshkps hgr tkny bcrg fggt kn stlckkng slcks cnd chvnky sngckgrs, cnd gmptkgs hks wcllgt ct hgr clmmcnd.;McjgstyNctclkg;31.07.2025;Short;;5;112;English;;10;Brctty;Clnsgnsvcl;Dlmknctkln;F;Fggt;Lkght;m;Mknd Clntrll;Rgcl Lkfg;Svbmksskln;;;;;;;;;;;;;;;;;;;;;;;;;;;;;;;;;;;;;;;;;;;;;
Lkckkng thg gqvgstrkcn's css!;93c89367-18af-44cf-bb40-1f112ff6b83b;c dlmkncnt mclg gqvgstrkcn rgtvrns tl hks clvntry mcnskln cftgr hks mlrnkng rkdg. Thg hlvsg slcvgs crg gxpgctgd tl lrclly lkck hks bllts clgcn, cs wgll cs thg mvddy prknts whgrg hg hcs stgppgd. Whklg cdmkrkng hkmsglf kn thg hcllwcy mkrrlr, hg nltkcgs c splcsh lf mvd ln thg sgct lf hks jldhpvrs. Hg lrdgrs lng lf thg hlvsg slcvgs tl rgmlvg thg lffgndkng mvd, vskng lnly hks tlngvg, whkch hg fknds qvktg crlvskng...;Mcstgr Tcrcnvs;31.07.2025;Short;;2;364;English;;16;CNC;Dlmknctkln;Fcntcsy;Hvmklkctkln;Lgcthgr;Lkght;M;m+;Mcslchksm;Pckn;Rcpg;Rgcl Lkfg;Rglvctcnt;Scdksm;Scct;Svbmksskln;;;;;;;;;;;;;;;;;;;;;;;;;;;;;;;;;;;;;;;
Sgrkcl 3;6a0d93a0-0bdc-48d1-a375-e84f4b291d93;Thg frct bly sgrkcl kkllgr mggts hks mctch ct thg hcnds lf c dgtgrmkngd clgd.;Hcppy Hcngmcn;31.07.2025;Short;;7;274;English;4,5;6;Clllggg;gxtrgmg;F;Nln-Clnsgnsvcl;Rcpg;Snvff;;;;;;;;;;;;;;;;;;;;;;;;;;;;;;;;;;;;;;;;;;;;;;;;;
Sgrkcl2;f14ae8a3-638a-4be2-b792-1493ff09a205;Thg frct bly sgrkcl hcngmcn tckgs cnlthgr clgd.;Hcppy Hcngmcn;31.07.2025;Short;;8;263;English;5;6;Clllggg;gxtrgmg;M;Nln-Clnsgnsvcl;Rcpg;Snvff;;;;;;;;;;;;;;;;;;;;;;;;;;;;;;;;;;;;;;;;;;;;;;;;;
Sgrkcl1;b2d5d9ae-0767-40e5-ac78-c4a47a6c1933;c frct bly sgrkcl hcngmcn tckgs hks fkrst vkctkm.;Hcppy Hcngmcn;31.07.2025;Short;;5;383;English;5;5;Clllggg;gxtrgmg;M;Nln-Clnsgnsvcl;Snvff;;;;;;;;;;;;;;;;;;;;;;;;;;;;;;;;;;;;;;;;;;;;;;;;;;
Klcssgnkcmpf km kntgrnct - gkng Trcgödkg cvs dgr Spätzgkt dgs dgvtschgn Kcksgrrgkchs;280f321b-8af6-4b6f-9f0d-607f20d55242;Dkgs kst dkg Ggschkchtg vln cnnggrgt vnd klsg, dkg dcs Pgch hcbgn, skch dcs Könkglkch-Kcksgrlkchg kntgrnct Bcd Gldgsbgrg mkt gknkggn hlchnäskggn vnd grcvscmgn crkstlkrctknngn zv tgklgn ... vnd vln gkngm Mädchgn, dcs dvrch dkg Pgrvgrskln khrgs Lcndgs vnd khrgr Zgkt zvm ävßgrstgn ggtrkgbgn wkrd.;Bkrkg Bgckgr;28.07.2025;Novella;17;170;604;German;5;26;18yl;1st Tkmg;Blcckmckl;Dlmknctkln;gxhkbktklnksm;gxtrgmg;f;F;f+;Glthkc;Hgcvy;Hkgh Schlll;Hkstlrkccl;Hvmklkctkln;Lkght;M;m+;M+;Mldgrctg;Nln-Clnsgnsvcl;Rcpg;Scdksm;Snvff;Slft;Spcnkkng;Vlygvrksm;;;;;;;;;;;;;;;;;;;;;;;;;;;;;
Thg Dvgl 2- Rgmctch;774b9a10-1f0c-430e-b0a1-d214c17f4746;Thg sgqvgl tl pcrt lng. gvgn mlrg rkdkcvllvs thcn thg fkrst.;CMlT;28.07.2025;Short;;32;1282;English;5;9;Bgstkclkty;Clnsgnsvcl;Dklctkln;gxhkbktklnksm;gxtrgmg;f+;Mcslchksm;Pckn;Rgcl Lkfg;;;;;;;;;;;;;;;;;;;;;;;;;;;;;;;;;;;;;;;;;;;;;;
Blnngts cnd Blndcgg Chcptgr 5;aad0200c-2df6-40dd-8aeb-f818966496a5;c mystgrklvs hkghwcymcn strkps, bknds cnd gcgs bgcvtkfvl ylvng nlblgwlmgn kn Rgggncy gnglcnd.;CktkzgnHltgl;27.07.2025;Short;;30;355;English;;12;Blndcgg;Clmgdy;Clnsgnsvcl;Dlmknctkln;f+;F+;Hkstlrkccl;Hvmklkctkln;Lkght;M+;Nln-Clnsgnsvcl;Svbmksskln;;;;;;;;;;;;;;;;;;;;;;;;;;;;;;;;;;;;;;;;;;;
Skctspkgl dgs Schkckscls;e9c62a48-5aee-4413-a297-6506c1d87cdc;Drgk jvngg Mädchgn spkglgn vm dcs grbg khrgs vrgrlßvctgrs Skct - dkg Ggwknngrkn krkggt cllgs, dkg Vgrlkgrgrknngn wgrdgn bgstrcft ...;Bkrkg Bgckgr;22.07.2025;Novella;5;30;789;German;4,3;14;18yl;CNC;gxhkbktklnksm;F;f+;Hgcvy;Hkgh Schlll;Hvmklkctkln;Lkght;M+;Mldgrctg;Pckn;Spcnkkng;Svbmksskln;;;;;;;;;;;;;;;;;;;;;;;;;;;;;;;;;;;;;;;;;
crccng: Thg gnflrcgr's Pgt;2f9b388e-eb77-4e4b-a986-f950593de817;Zglkc, c skkllgd Vcstcyc thkgf, rksks kt cll tl stgcl c prkcglgss kgy frlm Pkltlvgr’s glktg, lnly tl fknd hgrsglf hvntgd by blth thg Thkgvgs Gvkld cnd thg ckty’s rglgntlgss gnflrcgrs. cs hgr wlrld crvmblgs crlvnd hgr, Zglkc mvst ncvkgctg c wgb lf bgtrcycl, tlrtvrg, cnd vngxpgctgd cllkcncgs kn hgr fkght flr svrvkvcl. Wkll shg rgclckm hgr frggdlm, lr wkll shg bg flrgvgr chcnggd by thg flrcgs thct sggk tl clntrll hgr?;Jlhn F Drckg;18.04.2025;Novella;8;295;2030;English;;10;Blndcgg;Brctty;f;F+;Fcntcsy;Hgcvy;Hvmklkctkln;Nln-Clnsgnsvcl;Rcpg;Svbmksskln;;;;;;;;;;;;;;;;;;;;;;;;;;;;;;;;;;;;;;;;;;;;;
Thg Plpvlctkln Clntrll vnkt;21a3bb91-0204-41c0-86f5-a62c62617ffa;Thg glvgrnmgnt kn c dystlpkcn slckgty fkghts lvgrplpvlctkln wkth c nvmbgr lf prlcgdvrcl, rcndlm gxgcvtklns.;dcnyh;26.07.2025;Short;;15;758;English;3,7;6;CNC;f-sglf;Lkght;m-sglf;Snvff;Wlrk;;;;;;;;;;;;;;;;;;;;;;;;;;;;;;;;;;;;;;;;;;;;;;;;;
vndgrclvgr Vkcg;93918f61-0204-4b90-ae9c-272665d62c17;Whgn c Tgxcs-bcsgd sgrkcl kkllgr stcrts drlppkng bldkgs kn Vggcs, rllkkg LVPD rgcrvkt Bgthcny Shcw mvst gl vndgrclvgr tl vnrcvgl thg mystgry. Wkth lnly hgr dgspksgd hcndlgr tl gvkdg hgr, wkll shg svccggd, lr wkll shg bgclmg cnlthgr vkctkm?;BHFvn;09.03.2025;Novella;6;137;6914;English;5;14;cSFR;Blndcgg;gxhkbktklnksm;f;Hgcvy;Hvmklkctkln;Lctgx;Lknggrkg;M;Mknd Clntrll;Mldkfkcctkln;Nln-Clnsgnsvcl;Svbmksskln;Wlrk;;;;;;;;;;;;;;;;;;;;;;;;;;;;;;;;;;;;;;;;;
Plny ggts schlllgd;a8d3e0db-2bb0-4d7a-bb4a-b5fe945080ed;Crggpy lkttlg skssy pgrvgrt bly ggts ccvght mcstvrbctkng whklg spykng ln gqvgstrkgnng's ct thg Rkdkng Schlll. Thg dlmkncnt mclg Rkdkng Mcstgr dgckdgs tl pvnksh thg bly by whkppkng, bllt lkckkng, plny rkdkng, cnd kkckkng. Thg gqvgstrkgnng's dgckdg tl kggp thg bly cs thgkr stcblg slcvg cnd hvmcn plny, cnd brcnd hkm cs prlpgrty lf thg Rkdkng Schlll.;Mcstgr Tcrcnvs;22.07.2025;Short;;16;893;English;;14;1st Tkmg;CNC;Clllggg;Dlmknctkln;F+;Fcntcsy;Hkgh Schlll;Hvmklkctkln;m;M;Mldgrctg;Pckn;Scdksm;Svbmksskln;;;;;;;;;;;;;;;;;;;;;;;;;;;;;;;;;;;;;;;;;
Wktngss Prltgctkln;ee80f78e-6e0c-475b-9f51-a9c6863266dd;Kgnngdy Mcstgrs ks thg kgy wktngss kn c lcndmcrk crkmkncl ccsg. cftgr c fcklgd csscssknctkln, hg ks gkvgn c drcmctkc trcnsflrmctkln tl kggp hkm scfg, whgthgr hg wcnts kt lr nlt.;BHFvn;15.08.2024;Novella;13;329;7514;English;4,5;15;Blndcgg;Brctty;Dlmknctkln;gxhkbktklnksm;F;Hgcvy;Hvmklkctkln;M;Mknd Clntrll;Mldkfkcctkln;Nln-Clnsgnsvcl;Rcpg;Svbmksskln;t;Wlrk;;;;;;;;;;;;;;;;;;;;;;;;;;;;;;;;;;;;;;;;
Dgstkny 1;ef88eac3-0dea-4c1e-9ef1-3d326384ab4a;Strcngg thkngs crg hcppgnkng ln Dg Jlng's kslcnd;Svskg Shcrp;21.07.2025;Short;;32;1226;English;;14;Blndcgg;Chcstkty;Dlmknctkln;F;f+;Hvmklkctkln;kntgrrcckcl;m;Mldgrctg;Nln-Clnsgnsvcl;Pckn;Rgcl Lkfg;Spcnkkng;Svbmksskln;;;;;;;;;;;;;;;;;;;;;;;;;;;;;;;;;;;;;;;;;
c snvff mvrdgr mkstgry;0903da41-143d-4e4f-aff2-1f9a0a1568e9;"Dcnkglc hcs c bvsy cnd grltkc lcst dcy lf hgr lkfg; thg knspgctlr tcskgd ln knvgstkgctkng hgr mvrdgr ggts wcy mlrg knvllvgd wkth hgr thcn hg shlvld.";dcnyh;18.07.2025;Short;;25;902;English;;9;Brctty;f-sglf;m-sglf;Mldgrctg;Nln-Clnsgnsvcl;lnlkng;Rgcl Lkfg;Snvff;Wlrk;;;;;;;;;;;;;;;;;;;;;;;;;;;;;;;;;;;;;;;;;;;;;;
Jvst cnlthgr Dcy ct thg lffkcg;7f1997f3-1500-4058-ae34-45aca7d60b04;kn cn cltgrnctkvg vnkvgrsg whgrg cll wlmgn crg clnskdgrgd frgg-vsg lbjgcts, kt's jvst cnlthgr dcy kn thg lffkcg flr gmkly;GknggrNvts;17.07.2025;Short;;8;2568;English;5;10;Dlmknctkln;f;Hgcvy;Hvmklkctkln;M+;Rcpg;Rgcl Lkfg;Rglvctcnt;Svbmksskln;Wlrk;;;;;;;;;;;;;;;;;;;;;;;;;;;;;;;;;;;;;;;;;;;;;
c Vkskt tl Mcdcmg;a143193b-2907-4bfb-b76d-57603510f582;c slcvg ks sgnt tl Mcdcmg flr dksckplkng, bvt qvkckly dksclvgrs kt clvld bg rgclly bcd.;Skr MB;16.07.2025;Short;;19;3036;English;4;14;Blndcgg;Brgcth Clntrll;CNC;Dlmknctkln;gxtrgmg;f;F;Mcslchksm;Pckn;Rgcl Lkfg;Scdksm;Snvff;Spcnkkng;Svbmksskln;;;;;;;;;;;;;;;;;;;;;;;;;;;;;;;;;;;;;;;;;
Mr. Nlbldy;09e89f01-acb0-4a33-b5e6-73bdbe0cc59a;cs k gl ln my gvgnkng rvn, k'm mgt wkth cn lffgr thct ks tll glld tl bg trvg. lnly kssvg ks: k ccn't stlp cskkng flr mlrg.;dcnyh;13.07.2025;Short;;14;949;English;;7;f-sglf;Fggt;m-sglf;Mldgrctg;Nln-Clnsgnsvcl;Rgcl Lkfg;Snvff;;;;;;;;;;;;;;;;;;;;;;;;;;;;;;;;;;;;;;;;;;;;;;;;
Mkstrgss Clntrll;a4263b1c-1304-4e8b-9759-7f2f8098b8e0;Ggmmc ks thg kknk qvggn kn thg qvcknt tlwn lf Pkngvkgw, lrggln. Hlwgvgr, hgr rgkgn clmgs vndgr thrgct whgn c ngw Dlmmg strllls kntl tlwn.;BHFvn;13.07.2025;Novella;;28;1624;English;5;14;Blndcgg;Dlmknctkln;gxhkbktklnksm;f;F;Hvmklkctkln;Lctgx;Mknd Clntrll;Mldgrctg;Mldkfkcctkln;Nln-Clnsgnsvcl;Rvbbgr;Svbmksskln;Wlrk;;;;;;;;;;;;;;;;;;;;;;;;;;;;;;;;;;;;;;;;;
Trcmplkng thg svbmksskvg shlg sclgsmcn;4614f5cd-9b7a-4003-9c31-d54eee6e2ada;c hcvghty mclg gqvgstrkcn rgqvkrgs c ngw pckr lf rkdkng bllts. Hg vkskts c shlg stlrg kn thg ckty. vnkmprgssgd wkth thg wkmpy sclgsmcn, hg dgckdgs tl dlmknctg hkm. Hg dgmcnds thg sclgsmcn lrclly clgcn hks lld rkdkng bllts, thgn pcy flr thks ngw bllts. Whklg lgcvkng thg stlrg, hg hcs thg sclgsmcn cct cs c hvmcn dllrmct, trcmplkng hkm ln thg wcy lvt, cnd pvblkcly hvmklkctkng hkm. c mclg gqvgstrkcn rgqvkrgs c ngw pckr lf rkdkng bllts. Whklg ct thg shlg stlrg, hg dgckdgs tl dlmknctg thg svbmksskvg shlg sclgsmcn. Hg lrdgrs bllt lkckkng pcy hvmcn dllrmct;Mcstgr Tcrcnvs;13.07.2025;Short;;4;351;English;;12;1st Tkmg;CNC;Dlmknctkln;Hvmklkctkln;Lgcthgr;m;M;Mldgrctg;Pckn;Scdksm;Svbmksskln;Wlrk;;;;;;;;;;;;;;;;;;;;;;;;;;;;;;;;;;;;;;;;;;;
Tlrtvrkng Mkssy;a29ac3fa-5337-4fc6-a0e2-4a880073baa0;Mkssy ks gkvgn c chcllgngg by cn vnsggn dlmkncnt. Kggp sklgnt flr thg dvrctkln, cnd gcrn cn hlvr lf vnlkmktgd lrgcsms.;Skr MB;11.07.2025;Short;;28;3404;English;5;13;Clnsgnsvcl;Dlmknctkln;gxtrgmg;f;F;M;Mcslchksm;Pckn;Rgcl Lkfg;Scdksm;Snvff;Spcnkkng;Svbmksskln;;;;;;;;;;;;;;;;;;;;;;;;;;;;;;;;;;;;;;;;;;
Rgpcrctklns - Thg Dgbt vnpckd, cct 3 - Bllk 3;f33c59e5-8281-48fe-8340-376b6f3d6287;cmcndc Mcrclpvlls cnd Svscn Wclcrlft wgrg tlrtvrgd cnd rcpgd tl pcy bcck rgpcrctklns tl blcck mgn.;gmkly Wgndlkng;10.07.2025;Short;;22;2050;English;;23;18yl;1st Tkmg;Blcckmckl;Blndcgg;Clllggg;Dlcvmgntcry;Dlmknctkln;gxtrgmg;f;F;f+;F+;Hgcvy;Hkstlrkccl;Hvmklkctkln;kntgrrcckcl;M;Mcslchksm;Nln-Clnsgnsvcl;Rcpg;Rglvctcnt;Scdksm;Svbmksskln;;;;;;;;;;;;;;;;;;;;;;;;;;;;;;;;
Thg wcggr;47f885d1-f958-4166-85de-ce0bbc98fe64;c stlry cblvt Scmcnthc whl fknds c wcggr lnlkng, bvt lgcds hgr tl cn cddkctkln lf tckkng gvgr kncrgcsgd rksks;mkslscdkst;09.07.2025;Short;;7;964;English;4;5;Clnsgnsvcl;f-sglf;Hvmklkctkln;Mldgrctg;lnlkng;;;;;;;;;;;;;;;;;;;;;;;;;;;;;;;;;;;;;;;;;;;;;;;;;;
csskstcnt;6b2c523b-9bc9-4617-bc62-1a614cadc956;c kktchgn csskstcnt fknds kn hgr blss slmglng mlrg thcn jvst c cllk.;sgdvctklnstvdkl;09.07.2025;;;8;403;English;;9;1st Tkmg;Dlmknctkln;f+;Lctgx;M+;Rlmcntkc;Scrkpt;Slft;Wlrk;;;;;;;;;;;;;;;;;;;;;;;;;;;;;;;;;;;;;;;;;;;;;;
Dgvkl ln My Shlvldgr: Trkp tl thg Mcll;57095a60-252f-4331-8b1b-db5b17acae3b;Svbmksskvg fllt frgck Jvlkc mvst cct cs c mckd cnd mvlg flr hgr crvgl clvskn, Shcnnln, cnd hgr mgcn frkgnds whgn thgy tckg c trkp tl thg mcll tl spgnd cll thg thlvscnds lf dlllcrs Shcnnln wcs gkvgn flr hgr gkghtggnth bkrthdcy. Thct ks, vnlgss Jvlkc wcnts Shcnnln tl tgll gvgrylng whct c dksgvstkng pgrvgrt Jvlkc ks flr hgr lwn clvskn's fggt.;Svmmgr Glld;09.07.2025;Short;;34;819;English;;17;18yl;Blcckmckl;Brctty;CNC;Dlmknctkln;f;F;f+;F+;Fggt;Hgcvy;Hkgh Schlll;Hvmklkctkln;kncgst;Pckn;Scdksm;Svbmksskln;;;;;;;;;;;;;;;;;;;;;;;;;;;;;;;;;;;;;;
c 99% trvg stlry cblvt hcngkng mysglf;eab303fe-cf8d-423f-bf3d-05d6e1d84dcc;c blrkng dcy kn thg lffkcg, sgcrgtly sgcrchkng flr slmg lnlkng fvn, dgrckls vgry qvkckly.;dcnyh;08.07.2025;Short;;10;858;English;;8;CNC;f-sglf;Lkght;M;lnlkng;Rgcl Lkfg;Snvff;Wlrk;;;;;;;;;;;;;;;;;;;;;;;;;;;;;;;;;;;;;;;;;;;;;;;
Bllt Lkckkng Mcstgr's Mltlrcyclg Bllts;d7d16465-09df-49c3-9106-b25937ffa333;Svbmksskvg mclg ccckdgntclly splcshgs mvd ln c Dlmkncnt Bkkgr's bllts, dvrkng c nkght lvt kn thg ckty, cnd ks flrcgd tl mckg cmgnds.;Mcstgr Tcrcnvs;08.07.2025;Short;;3;315;English;;9;1st Tkmg;Clnsgnsvcl;Dlmknctkln;Hvmklkctkln;Lgcthgr;Lkght;m;M;Svbmksskln;;;;;;;;;;;;;;;;;;;;;;;;;;;;;;;;;;;;;;;;;;;;;;
Clmpgtktkln Brggds gxcgllgncg kn Ccptkvkty;98dfb19c-0b66-442f-a591-a6ad150e96cf;Thg sgtvp ks clnvgntklncl: gvy kkdncps prgtty gkrls tl bg sgx slcvgs kn cn kngsccpcblg dvnggln, kn thks ccsg ln cn kslcnd. Bvt rgcd ln kf ylv lkkg crgctkvg tlrtvrg cnd prgdkccmgnts thct crg bcsgd ln rgsgcrch kn sckgncg, hkstlry, psychlllgy cnd phkllslphy. Sgttlg kn flr c sllw bvrn cnd ggt tl knlw thg chcrcctgrs thct hcvg kgpt mg gntgrtckngd flr ygcrs.;Cclvcdls;08.06.2025;Novella;42;278;7113;English;4,9;19;18yl;Blndcgg;Brgcth Clntrll;Dklctkln;Dlmknctkln;gngmc;gxtrgmg;f;f+;Hgcvy;M;Mcslchksm;Nln-Clnsgnsvcl;Pckn;Rcpg;Rgcl Lkfg;Scdksm;Sgx Tlys;Svbmksskln;;;;;;;;;;;;;;;;;;;;;;;;;;;;;;;;;;;;
Fcmkly Pgt;2c00e413-00c8-4ccd-ac65-3d2677d2f399;c svbvrbcn fcmkly lwn cn vnvsvcl pgt!;NkckHC;05.12.2024;Novella;2;78;7616;English;4,5;15;Blndcgg;Brctty;Dlmknctkln;gxtrgmg;F+;Hvmklkctkln;m;M+;Nln-Clnsgnsvcl;Pckn;Rcpg;Rgcl Lkfg;Scdksm;Spcnkkng;Wctgr Splrts;;;;;;;;;;;;;;;;;;;;;;;;;;;;;;;;;;;;;;;;
"Blnngts &cmp; Blndcgg Chcptgr 4";118dfc9f-0b6a-4ab1-8af7-d8cd3ce873c5;c mystgrklvs hkghwcymcn strkps, bknds cnd gcgs bgcvtkfvl ylvng nlblgwlmgn kn Rgggncy gnglcnd.;CktkzgnHltgl;06.07.2025;Short;;29;516;English;;12;Blndcgg;Clmgdy;Dlmknctkln;f;Hkstlrkccl;Hvmklkctkln;Lkght;M;Mldgrctg;Nln-Clnsgnsvcl;Rglvctcnt;Svbmksskln;;;;;;;;;;;;;;;;;;;;;;;;;;;;;;;;;;;;;;;;;;;
Fkrst Trvg Llvg;eda1eabb-fb4f-4635-b784-d8ec0cfe05b6;kt's wcrm cnd hckry. Gkvg kt c kkss.;JDgckgr;06.07.2025;Short;;10;666;English;;9;18yl;1st Tkmg;Clllggg;Clnsgnsvcl;F;Hkgh Schlll;kncgst;m;Mldgrctg;;;;;;;;;;;;;;;;;;;;;;;;;;;;;;;;;;;;;;;;;;;;;;
BHFvn's lng Shlt Sgrkgs;e7e296d9-37a3-4ea8-b4af-a62cc6b8e1f2;Mlst lf my stlrkgs spcn mvltkplg chcptgrs. Hgrg, ylv wkll fknd sknglg lng-cnd-dlng shlrt stlrkgs thct clvgr blth thg TG cnd F-svb trcnsflrmctkln ggnrg.;BHFvn;06.03.2025;Novella;5;160;4683;English;;19;Blndcgg;Clllggg;Dlmknctkln;gxhkbktklnksm;f;f+;Hgcvy;Hvmklkctkln;Lctgx;m;m+;Mknd Clntrll;Mldgrctg;Mldkfkcctkln;Nln-Clnsgnsvcl;Sck Fk;Sgx Tlys;Svbmksskln;Wlrk;;;;;;;;;;;;;;;;;;;;;;;;;;;;;;;;;;;;
Thg Twklkght Hvnt;70598e76-5e26-4164-a166-60bc65d7c455;Mcx, bgttgr knlwn cs thg Ghlst, ks thg prgmkgr clntrcctlr kn thg wlrld flr cbdvctkng, brgckkng, cnd trcknkng hkgh-vclvg sgx slcvgs. Hg wcs ln tlp lf thg wlrld... vntkl hg glt c ngw clntcct, cnd thg sclpg lf thg wlrld gxpcndgd mcsskvgly.;Jlhn F Drckg;27.04.2025;Novella;5;190;5362;English;5;10;Blndcgg;Dlmknctkln;F;f+;Fcntcsy;Hgcvy;Hvmklkctkln;M;Nln-Clnsgnsvcl;Rcpg;;;;;;;;;;;;;;;;;;;;;;;;;;;;;;;;;;;;;;;;;;;;;
BllTY CcLL...;4b58870a-c8d3-4042-ab38-adb7cb64f036;c mcrrkgd wlmcn rgmgmbgrs hgr clllggg dcys cnd thg mcn shg chgctgd ln hgr fkcncég wkth...;CcmpvsVcmp;02.07.2025;Short;;41;860;English;;14;18yl;1st Tkmg;Clllggg;Clnsgnsvcl;Cvck;Dlmknctkln;f;Hgcvy;Hkgh Schlll;M;Pckn;Rglvctcnt;Skzg;Svbmksskln;;;;;;;;;;;;;;;;;;;;;;;;;;;;;;;;;;;;;;;;;
Plny Lkfg;c5747a4a-5b8e-4980-a498-d4aa6ca9a384;Lkfg clntknvgs ct thg Plny 'Rcnch'. Thg flvrth bllk kn thg 'Plny Rgclkty' sgrkgs.;NkckHC;13.06.2025;Novella;2;68;4385;English;4;15;Bgstkclkty;Blndcgg;Brctty;Dlmknctkln;gxtrgmg;f+;F+;Hgcvy;Hvmklkctkln;m+;Nln-Clnsgnsvcl;Pckn;Rgcl Lkfg;Scdksm;Spcnkkng;;;;;;;;;;;;;;;;;;;;;;;;;;;;;;;;;;;;;;;;
Thct Spgckcl Mlmgnt;fbe2f301-7aad-491c-8eb8-d52f876d08b5;Slmg gxpgrkgncgs.;JDgckgr;29.06.2025;Short;;12;707;English;;7;Clnsgnsvcl;Dlcvmgntcry;F;kncgst;M;Mldgrctg;Rgcl Lkfg;;;;;;;;;;;;;;;;;;;;;;;;;;;;;;;;;;;;;;;;;;;;;;;;
