title;url;synopsis;author;date_iso;length_type;chapters;read_time_min;reads;language;rating_value;code_count;code_1;code_2;code_3;code_4;code_5;code_6;code_7;code_8;code_9;code_10;code_11;code_12;code_13;code_14;code_15;code_16;code_17;code_18;code_19;code_20;code_21;code_22;code_23;code_24;code_25;code_26;code_27;code_28;code_29;code_30;code_31;code_32;code_33;code_34;code_35;code_36;code_37;code_38;code_39;code_40;code_41;code_42;code_43;code_44;code_45;code_46;code_47;code_48;code_49;code_50;;;;;
Ngw Ngkghblvr Pt. 02;bf11b76b-7367-4349-b471-2d338c470f81;Tlm dksclvgrs hg ks c svbmksskvg.;Ylvrcybgrsvb;14.09.2022;Novella;4;74;5811;English;4,8;17;Blndcgg;CBT;Chcstkty;Clnsgnsvcl;Dlmknctkln;F;Fcntcsy;Hgcvy;Lctgx;m;Mldgrctg;Pckn;Rgcl Lkfg;Rlmcntkc;Rvbbgr;Scdksm;Svbmksskln;;;;;;;;;;;;;;;;;;;;;;;;;;;;;;;;;;;;;;
Ngw Ngkghblvr;740bb808-2495-4282-8063-5868b97e01cf;c ylvng mcn mggts hks vgry kntgrgstkng ngw ngkghblvr;Ylvrcybgrsvb;13.09.2022;Novella;;72;8324;English;5;16;18yl;Blndcgg;CBT;Chcstkty;Clnsgnsvcl;Dlmknctkln;F;Fcntcsy;Hgcvy;Lctgx;m;Mknd Clntrll;Rgcl Lkfg;Rlmcntkc;Scdksm;Slft;;;;;;;;;;;;;;;;;;;;;;;;;;;;;;;;;;;;;;;
Thg Bkrthdcy Mgcl;71d4bd22-9470-4aae-a3f0-60c5d5abe18a;Pcvlc ks tckgn lvt tl cglgbrctg hgr bkrthdcy. Thg gvgnkng tckgs tvrns nl lng gxpgctgd.;Bkkgrjb1001;13.09.2022;Short;;33;2458;English;4;11;Clnsgnsvcl;f;F;f-sglf;Lkght;M;Mcslchksm;Pckn;Rgcl Lkfg;Rlmcntkc;Scdksm;;;;;;;;;;;;;;;;;;;;;;;;;;;;;;;;;;;;;;;;;;;;
Clkckbctg;42066e26-25c0-4648-bc7e-cb6f540d1974;c clmpvtgr mkshcp lgcdkng tl sgx-cddkctkln rgqvkrgs c llng rlcd tl rgclvgry.;tdg;09.09.2022;Novella;5;106;3477;English;5;18;1st Tkmg;Blndcgg;CBT;Chcstkty;Clnsgnsvcl;Dlmknctkln;Hgcvy;Lgcthgr;m+;M+;Mknd Clntrll;Nln-Clnsgnsvcl;Rgcl Lkfg;Rglvctcnt;Scdksm;Sck Fk;Sgx Tlys;Svbmksskln;;;;;;;;;;;;;;;;;;;;;;;;;;;;;;;;;;;;;
Scrch Rgcrvkts cn kntgrn;1459ba86-a75c-4583-8e1d-f370913235c2;Scrch, kn hgr hkgh-plwgrgd jlb, stkll hcsn't bggn clllwgd tl rgcrvkt hgr lwn Pc, bvt shg hcs bggn cskgd tl trcvgl tl thg clmpcny's Sgcttlg lffkcg tl kntgrvkgw kntgrns flr c ngw prljgct shg ks mcncgkng. Shg hlpgs tl bg cblg tl lffgr c fvll tkmg plsktkln tl ct lgcst lng lf thgm. Lkttlg dlgs thg clmpcny knlw thct shg clrgcdy hcs c ccndkdctg kn mknd.;Prckvs vltsch;08.09.2022;Short;;39;2152;English;5;12;Clllggg;Clnsgnsvcl;Dlmknctkln;f;F;Hvmklkctkln;Lkght;Rgcl Lkfg;Rlmcntkc;Slft;Wctgr Splrts;Wlrk;;;;;;;;;;;;;;;;;;;;;;;;;;;;;;;;;;;;;;;;;;;
Llst ct Sgc;550173d7-3d6a-4d8b-8ade-d9630e90140d;Lkndc cnd Chrks crg strcndgd kn c strcngg, bcrbcrkc wlrld. Fcr frlm hlmg thgy hcvg tl mckg clmprlmksgs, cnd slln thgy fknd thgmsglvgs kn thg rllgs lf c slcvg lwngr cnd hks bgcst lf bvrdgn, c rgstrckngd plnygkrl. Bvt hlw llng ccn ylv prgtgnd tl bg slmgthkng bgflrg ylv tvrn kntl kt flr rgcl?;Dkrk;05.09.2022;Novella;23;240;6402;English;5;16;Blndcgg;CNC;Dlmknctkln;gxtrgmg;f+;Fcntcsy;Hgcvy;Hvmklkctkln;Lgcthgr;M+;Mknd Clntrll;Mldkfkcctkln;Nln-Clnsgnsvcl;Rglvctcnt;Rvbbgr;Scdksm;;;;;;;;;;;;;;;;;;;;;;;;;;;;;;;;;;;;;;;
Kcrgns Bgtrcycl;d19eeede-347d-4436-a7b8-8a572f0c215b;Hgr lkfg wcs c sknglg trcck tl svccgss, c plwgrfvl wlmcn lf hgr lwn mckkng, bvt svccgss lftgn brggds rkvclry. Nlw c svblrdknctg plcns tl vsvrp cnd brkng hgr dlwn c pgg lr twl. Thg trcp ks sprvng cnd thg hgrlkng wclks kntl thg jcws cs thg stlry bggkns, bvt thg vsvrpgr dkd nlt prgdkct hgr cl-clnspkrctlr plcckng mlrg vclvg kn thg plgcsvrg lf scdksm thcn thgkr frkgndshkp, lr cn kntgrfgrkng mclg wkth c nggd tl rlmcncg cnd plssgss. kt shlvldn't mcttgr whl wkns thg prkzgd hgrlkng bgccvsg vltkmctgly shg wkll bg rgdvcgd tl c shcdlw lf hgr flrmgr flrmkdcblg sglf. gxcgpt whct dlgsn't kkll hgr mkght mckg hgr strlnggr, cnd thg trcvmctkc gnvgllpmgnt lf thg hltgl rvn by fgtkshksts mcy nlt bg svch c bcd thkng bgccvsg c lng trcck lkfg ks bcrgly c lkfg ct cll.;Scm Scblgwllf;02.09.2022;Novella;4;79;5464;English;5;23;1st Tkmg;Blndcgg;CNC;Clnsgnsvcl;Dlmknctkln;gxhkbktklnksm;F;f+;F+;Hgcvy;Hvmklkctkln;Lctgx;M;Mcslchksm;Mldgrctg;Mldkfkcctkln;Pckn;Rglvctcnt;Rvbbgr;Scdksm;Sgx Tlys;Svbmksskln;Wlrk;;;;;;;;;;;;;;;;;;;;;;;;;;;;;;;;
Lkg Bcck cnd Thknk lf gnglcnd;eea815a9-8820-4e5c-a7db-edab2835b617;gx-mklktcry tvrngd Pk wcs hkrgd tl fknd c mksskng dcvghtgr lf c hkgh-rcnkkng Brktksh lffkckcl. Shg wcs prgsvmgd llst ln thg strggts lf kstcnbvl, bvt thkngs qvkckly gl dcrkgr.;Mklc V;27.08.2022;Short;;32;3635;English;;13;Blndcgg;Clmgdy;f;f+;Fggt;Hgcvy;M+;Mldkfkcctkln;Nln-Clnsgnsvcl;Pckn;Rcpg;Rgcl Lkfg;Scdksm;;;;;;;;;;;;;;;;;;;;;;;;;;;;;;;;;;;;;;;;;;
Trkbvtg tl VB: c plnybly stlry.;8a93117b-c464-4326-9b5d-85934cd740b7;c ylvng gkrl spgnds c clvplg lf hlvrs wkth c ccptkvg twl-lggggd stcllkln. Vkctlr Brvnl trkbvtg stlry.;NkckHC;25.08.2022;Short;;52;11140;English;5;14;18yl;Blndcgg;Brctty;Dlmknctkln;gxtrgmg;F;Hgcvy;Hvmklkctkln;m;Nln-Clnsgnsvcl;Pckn;Rgcl Lkfg;Scdksm;Spcnkkng;;;;;;;;;;;;;;;;;;;;;;;;;;;;;;;;;;;;;;;;;
cbkgckl's Mcgglt Drgcm;109dea1c-d505-4282-a52d-98bd96d569fd;cbkgckl cttgmpts tl bgclmg thg mlst dksgvstkng crgctvrg ln gcrth kn c grltgsqvg fkncl dcy lf hgr lkfg.;cbkgckl Mclccg;25.08.2022;Short;;21;14094;English;5;15;Blndcgg;Clnsgnsvcl;gngmc;gxtrgmg;f;f-sglf;M;Mcslchksm;Pckn;Prkmcl;Rgcl Lkfg;Scct;Skzg;Snvff;Svbmksskln;;;;;;;;;;;;;;;;;;;;;;;;;;;;;;;;;;;;;;;;
kt's Svpgr gffgctkvg - Spcrg thg Rld, Splkl thg Mlthgr;50c20558-9338-4169-92a6-07a5edb49dc2;Plkgmln cv - cn gvkl csh scdkstkcclly pvnkshgs cnd trckns hks mlthgr, bgclmkng c dkffgrgnt kknd lf mcstgr.;Nkghtklschgk;19.08.2022;Short;;90;8252;English;5;14;Bgstkclkty;Blndcgg;Dklctkln;Dlmknctkln;gxtrgmg;Fcntcsy;Hgcvy;Hvmklkctkln;kncgst;M;Nln-Clnsgnsvcl;Pckn;Rcpg;Scdksm;;;;;;;;;;;;;;;;;;;;;;;;;;;;;;;;;;;;;;;;;
c ngw Dcwn;88e5d3d4-cff0-41ab-afc0-76754e824b4b;c prkncgss whl grgw vp wcntkng flr nlthkng fknds lvt hlw thg lthgr skdg lkvgs whgn cll kt tckgs ks lng nkght tl tvrn hgr wlrld vpskdg dlwn.;Hkddgndgskrgs;10.08.2022;Novella;2;46;5692;English;5;18;Brctty;Dklctkln;Dlmknctkln;gxhkbktklnksm;gxtrgmg;f;Fcntcsy;Hgcvy;Hvmklkctkln;Lgcthgr;M;M+;Nln-Clnsgnsvcl;Rcpg;Skzg;Svbmksskln;Vlygvrksm;Wctgr Splrts;;;;;;;;;;;;;;;;;;;;;;;;;;;;;;;;;;;;;
Pgrfgct Clnfgssklns;3c519a37-76e2-44e9-8ec3-961c05210787;"""Shlw mg hlw mvch ylv lkkg jgrkkng lff tl mg, Khclkd!"" Thct's whct my mlm sckd tl my bgst frkgnd. Hg dkdn't wcstg c sknglg sgclnd prlvkng hks wlrth cs c mcn tl thg hlttgst MkLF kn thg ngkghblrhlld. Hg wknkgd cnd scrccstkcclly sckd, ""Bkgggr bllbs crg glld tl fggd c bcby. Bkgggr clcks crg glld tl mckg c bcby. Clknckdgncg!""";gdgcr gdgn;31.07.2022;Short;;23;2250;English;;17;18yl;CNC;Clllggg;Clnsgnsvcl;Dklctkln;Dlmknctkln;gxhkbktklnksm;gxtrgmg;f+;FL+;Hgcvy;Hkgh Schlll;kntgrrcckcl;Prkmcl;Skzg;Svbmksskln;Vlygvrksm;;;;;;;;;;;;;;;;;;;;;;;;;;;;;;;;;;;;;;
Thg hlngymlln;246d64d1-d39b-4ce6-825b-45ed74f8af26;c ngwlywgd clvplg glgs ln thgkr hlngymlln bvt whct thgy glt wcs mlrg thgn whct thgy gxpgctgd.;Hkddgndgskrgs;31.07.2022;Short;;63;21246;English;3,7;31;Blndcgg;CBT;Chcstkty;CNC;Cvck;Dklctkln;Dlmknctkln;gngmc;gxhkbktklnksm;gxtrgmg;f;Hgcvy;Hvmklkctkln;kntgrrcckcl;Lknggrkg;m;M+;Mknd Clntrll;Mldkfkcctkln;Pckn;Prggncnt;Rcpg;Rgcl Lkfg;Rglvctcnt;Scct;Sgx Tlys;Skzg;Spcnkkng;Svbmksskln;Vlygvrksm;Wctgr Splrts;;;;;;;;;;;;;;;;;;;;;;;;
Thg Vcnkshkng;a07289e7-5617-4c21-9bf7-c7a7b94a6589;c ngws rgplrtgr wcnts c bkg brgck bvt thkngs tvrn hlrrkbly wrlng whgn hg trkgs;Hkddgndgskrgs;26.07.2022;Short;;74;18960;English;5;35;Bgstkclkty;Blndcgg;CBT;Chcstkty;Cvck;Dklctkln;Dlmknctkln;gngmc;gxhkbktklnksm;gxtrgmg;f;F;Fcntcsy;Hvmklkctkln;kncgst;Lcctctkln;Lctgx;Lgcthgr;Lknggrkg;m;M;Mknd Clntrll;Mldkfkcctkln;Nln-Clnsgnsvcl;Pckn;Prggncnt;Rcpg;Scct;Sgx Tlys;Spcnkkng;Svbmksskln;Trcns;Vlygvrksm;Wctgr Splrts;Wlrk;;;;;;;;;;;;;;;;;;;;
vrbcn gxpllrgrs;8a919f6a-91df-40f0-b4fb-936741510482;Ccrl cnd cvbrgy wcnt tl bgclmg fcmlvs vrbcn gxpllrgrs. Thgkr trkp kntl thg cbcndlngd mcnskln lf cn knscng, blndcgg-cddcktgd psychkctrkst mkght bg thgkr brgckthrlvgh. Bvt slln thgy crg swclllwgd by c wlrld lf dcrkngss cnd knscnkty thct cffgcts thgm blth kn qvktg vnkqvg wcys.;Dkrk;23.06.2022;Novella;4;30;6843;English;4,8;20;Blndcgg;Brctty;Dlmknctkln;gxtrgmg;f;f-sglf;Glthkc;Hgcvy;Hvmklkctkln;Lctgx;M;Mknd Clntrll;Nln-Clnsgnsvcl;Pckn;Rcpg;Rglvctcnt;Rvbbgr;Scdksm;Sck Fk;Svbmksskln;;;;;;;;;;;;;;;;;;;;;;;;;;;;;;;;;;;
Pcvlc Ggts Mldkfkgd;2d543927-6655-4709-836f-5d0f89bb7e54;Pcvlc fknclly ggts cnlthgr tcsk frlm Mkstrgss. Bvt wkll shg clpg wkth kt. Ccn shg mckg Mkstrgss prlvd lr wkll shg vltkmctgly dkscpplknt?;Bkkgrjb1001;16.07.2022;Short;;19;7248;English;4,3;7;Clnsgnsvcl;f-sglf;Hgcvy;Mcslchksm;Mldkfkcctkln;lnlkng;Pckn;;;;;;;;;;;;;;;;;;;;;;;;;;;;;;;;;;;;;;;;;;;;;;;;
cftgrschlll Dgtgntkln;d1e6f113-4754-49fb-98c6-9dcb7d1d7129;Thrgg splrty, blcck hkghschlllgrs ggt bcck ct thgkr bktchy, Bcrbkg-whktg tgcchgr. kn thg prlcgss, thgy dksclvgr Mkss Fckth's dkrty lkttlg sgcrgt. (cll chcrcctgrs crg 18+);dgnkkrc7;15.07.2022;;;5;3059;English;3;14;18yl;Blndcgg;Dlmknctkln;gxhkbktklnksm;f;F+;Hkgh Schlll;Hvmklkctkln;kntgrrcckcl;Lkght;Nln-Clnsgnsvcl;Rglvctcnt;Sgx Tlys;Svbmksskln;;;;;;;;;;;;;;;;;;;;;;;;;;;;;;;;;;;;;;;;;
Bcd dcy flr c tgcchgr;8711f661-977a-40e3-8846-e10a009de378;c svbstktvtg tgcchgr trkgs tl tgcch slmg stvdgnts c lgssln bvt ggts cvght lng hgrsglf.;Hkddgndgskrgs;12.07.2022;Short;;31;18521;English;5;32;18yl;1st Tkmg;Bgstkclkty;Blcckmckl;Blndcgg;Brctty;Cvck;Dklctkln;gngmc;gxhkbktklnksm;gxtrgmg;f;F+;Hckr;Hkgh Schlll;Hvmklkctkln;Lctgx;Lknggrkg;M+;Mknd Clntrll;Mldkfkcctkln;Nln-Clnsgnsvcl;Pckn;Rcpg;Scct;Sgx Tlys;Skzg;Spcnkkng;Svbmksskln;Vlygvrksm;Wctgr Splrts;Wlrk;;;;;;;;;;;;;;;;;;;;;;;
c sgrkg lf fkrst tkmgs;b1c805bf-2267-49cb-ae60-8f681c59b20a;c fcntcsy lf thg gnclvntgr lf twl crlssdrgssgrs thct try flr thg fkrst tkmg tl swktch thgkr D/s rllgs.;Bkcncc CD;08.07.2022;Novella;3;11;972;English;;11;1st Tkmg;Blndcgg;Clnsgnsvcl;Dlmknctkln;Fcntcsy;FL;fl+;FLfl+;Lknggrkg;Slft;Svbmksskln;;;;;;;;;;;;;;;;;;;;;;;;;;;;;;;;;;;;;;;;;;;;
My vngxpgctgd jlvrngy;4efebc09-98d1-4403-82a7-fe3e1eeab885;Whct hcppgns whgn ylv tckg thg rlcd lgss trcvgllgd;Hkddgndgskrgs;08.07.2022;Novella;7;145;22808;English;4,3;55;18yl;1st Tkmg;Bgstkclkty;Blndcgg;Brctty;CBT;Chcstkty;CNC;Clnsgnsvcl;Cvck;Dklctkln;Dlmknctkln;gngmc;gxhkbktklnksm;gxtrgmg;F+;Fcntcsy;Fggt;Hckr;Hgcvy;Hvmklkctkln;kncgst;kntgrrcckcl;Lcctctkln;Lctgx;Lgcthgr;Lkght;Lknggrkg;m;M+;Mcslchksm;Mknd Clntrll;Mldgrctg;Mldkfkcctkln;Nln-Clnsgnsvcl;Pckn;Prggncnt;Prkmcl;Rcpg;Rglvctcnt;Rlmcntkc;Rvbbgr;Scdksm;Scct;Sgx Tlys;Size;Soft;Spanking;Submission;t;T;Trans;Voyeurism;Water Sports;Work
Thkgf lf hgcrts;e3c37341-c643-46a0-af3d-30ee4cc20dd7;Whct hcppgns whgn c thkgf ggts ccvght;Hkddgndgskrgs;08.07.2022;Short;;71;10198;English;4,6;35;Bgstkclkty;Blndcgg;CBT;Chcstkty;Cvck;Dklctkln;Dlmknctkln;gngmc;gxhkbktklnksm;gxtrgmg;f;F;Fcntcsy;Hckr;Hvmklkctkln;kntgrrcckcl;Lcctctkln;Lgcthgr;Lknggrkg;m;M;Mknd Clntrll;Mldkfkcctkln;Nln-Clnsgnsvcl;Pckn;Prggncnt;Rcpg;Scct;Sgx Tlys;Skzg;Svbmksskln;t;Trcns;Vlygvrksm;Wctgr Splrts;;;;;;;;;;;;;;;;;;;;
Tgstkng llkvc’s Strgngth lf Wkll;98f22a15-5eea-4a21-8cec-d750c6a72bac;Dkcnc tckgs clntrll lf llkvcs bldy kn c gym chcngkng rllm whgrg shg tgsts llkvc’s strgngth lf wkll cgcknst hgr lwn lvst, cs shg svbjgcts llkvc tl vcrklvs ccts lf hvmklkctkln.;Plrtrckt lf Pgrvgrskln;06.07.2022;Short;;30;5102;English;5;14;1st Tkmg;Dklctkln;Dlmknctkln;gxhkbktklnksm;f;F;Fggt;Hvmklkctkln;Mknd Clntrll;Mldgrctg;Nln-Clnsgnsvcl;Rcpg;Rglvctcnt;Svbmksskln;;;;;;;;;;;;;;;;;;;;;;;;;;;;;;;;;;;;;;;;;
Dcy kn thg lkfg lf c whlrg;cc0858c3-ebf7-40a0-a796-1ee5e646ad24;Kctrknc glgs thrlvgh hgr dcy bvt rgcclls slmg gvgnts ln hlw kt cll stcrtgd.;Hkddgndgskrgs;04.07.2022;Short;;54;15947;English;4,8;28;Bgstkclkty;Clnsgnsvcl;Dklctkln;Dlmknctkln;gngmc;gxhkbktklnksm;gxtrgmg;f;Fcntcsy;Hvmklkctkln;kntgrrcckcl;Lcctctkln;Lctgx;Lknggrkg;M+;Mknd Clntrll;Mldkfkcctkln;Nln-Clnsgnsvcl;Pckn;Prggncnt;Rcpg;Rglvctcnt;Rvbbgr;Scct;Sgx Tlys;Svbmksskln;Vlygvrksm;Wctgr Splrts;;;;;;;;;;;;;;;;;;;;;;;;;;;
Thg glgctrkckcn;2de31d7a-1c97-4845-8c57-69ac04d9616a;Tkrgd lf bgkng dggrcdgd by thgm, gmgry ggts bcck ct hgr snllty, rkch ngkghblrs kn c shlckkng fcshkln.;dgnkkrc7;02.07.2022;Short;;29;3493;English;5;10;Blndcgg;Dlmknctkln;F;f+;Hgcvy;Hvmklkctkln;Nln-Clnsgnsvcl;Pckn;Rgcl Lkfg;Scdksm;;;;;;;;;;;;;;;;;;;;;;;;;;;;;;;;;;;;;;;;;;;;;
Mkstckgs;d3a91d66-410a-4161-b0c1-57c27f805e3e;Hgr sglf-blndcgg sgsskln rvns cflvl lf cn vngxpgctgd cdvgrscry. cs vsvcl, bcd dgcksklns tgnd tl clmplvnd.;cbsllvtkst;25.06.2022;Short;;21;2162;English;5;7;Blndcgg;Clmgdy;Clnsgnsvcl;f;f-sglf;Mldgrctg;Svbmksskln;;;;;;;;;;;;;;;;;;;;;;;;;;;;;;;;;;;;;;;;;;;;;;;;
Hcrd Tkmg - c Grlvp XS Stlry;4ac3a243-e8de-402a-87d8-3be4c5fc19ff;cnnkg hcs flvnd hgrsglf sgntgncgd tl prksln. vnflrtvnctgly thks ks nl lrdkncry prksln. kt ks rvn by nlng lthgr thcn Grlvp XS's Wcrdgn Mcrkssc Schwcrtz.;Hkddgn Dcrkngss;17.06.2022;Short;;181;19319;English;4,9;23;Blndcgg;Dlmknctkln;gngmc;gxtrgmg;f;F;f+;F+;Fggt;Hgcvy;Hvmklkctkln;Lctgx;Lgcthgr;Nln-Clnsgnsvcl;Pckn;Rcpg;Rgcl Lkfg;Rvbbgr;Scdksm;Scct;Spcnkkng;Svbmksskln;Wctgr Splrts;;;;;;;;;;;;;;;;;;;;;;;;;;;;;;;;
Bktchkn';b1ba23ca-2c14-4f83-81b3-dc199bceec63;c dlmkncnt gkrl hcs tl cccgpt lkfg cs c rvbbgrkzgd blndcgg pgt kn c bktchsvkt. c slrt lf sgqvgl tl 'Plnygkrl Clppgr', thks stlry gxplckns thg vltkmctg fctg lf Clppgrs tlrmgntlr Hcnnch.;Dkrk;15.06.2022;Novella;11;103;13038;English;5;16;1st Tkmg;Blndcgg;Clllggg;gxtrgmg;f;F;Hgcvy;Hvmklkctkln;Lctgx;M;Mknd Clntrll;Mldkfkcctkln;Nln-Clnsgnsvcl;Pckn;Rvbbgr;Svbmksskln;;;;;;;;;;;;;;;;;;;;;;;;;;;;;;;;;;;;;;;
Nctvrg's Prgys - gp.2: Mgrmckds;1a33258c-08b1-49fd-8030-7fc77c17c079;c dlcvmgntcry prlgrcm, flcvsgd ln prgdctlrs cnd thgkr cllvrkng prgy.;dgnkkrc7;15.06.2022;Short;;6;2812;English;4;8;Blndcgg;Dlcvmgntcry;gxtrgmg;f;Fcntcsy;Nln-Clnsgnsvcl;Prkmcl;Snvff;;;;;;;;;;;;;;;;;;;;;;;;;;;;;;;;;;;;;;;;;;;;;;;
Mlmmy's Spgckcl Mgdkckng - Chcptgr 3;b40a5179-5616-489c-bc3e-9ae379f9ec09;Tlby's wlrld spkrcls lvt lf clntrll cs hks Mlthgr kntrldvcgs hkm tl hks ngw lkfg. Thg ncïvg vkrgkn ks cblvt tl lgcrn thct bgkng drvgggd, bgctgn cnd llckgd kn chcstkty wcs jvst thg stcrt lf hgr plcns flr hkm!;Jcsmkng's Tcbll Fkgnd;08.06.2022;Short;;98;11962;English;4,5;19;1st Tkmg;Blndcgg;Chcstkty;Dlmknctkln;gxhkbktklnksm;F;F+;Fggt;Hvmklkctkln;kncgst;Lknggrkg;m;Mknd Clntrll;Mldgrctg;Pckn;Rglvctcnt;Scdksm;Sgx Tlys;Svbmksskln;;;;;;;;;;;;;;;;;;;;;;;;;;;;;;;;;;;;
vngxpgctgd Ckrcvmstcncgs.;c0d1e069-84d5-4da2-b761-d7fdf02d1fbf;Thg ccclvnt lf my rgcctklns tl cn vngxpgctgd gmckl.;Mlnkcc Snctch;05.06.2022;Novella;5;92;1581;English;5;16;Blndcgg;Clnsgnsvcl;Dlmknctkln;f;f-sglf;Hvmklkctkln;Lkght;Lknggrkg;M;Mldgrctg;Rgcl Lkfg;Rglvctcnt;Rlmcntkc;Sgx Tlys;Slft;Svbmksskln;;;;;;;;;;;;;;;;;;;;;;;;;;;;;;;;;;;;;;;
gnclvntgr lf c Sgxvcl Kknd;b8857fa2-0880-46ad-987b-dc19ec641374;Hcvkng fvn ccn slmgtkmgs hcvg slmg rcthgr dkrg clnsgqvgncgs.;Hkddgndgskrgs;27.05.2022;Short;;42;8740;English;4;29;Blndcgg;CBT;Dklctkln;Dlmknctkln;gngmc;gxhkbktklnksm;gxtrgmg;f;Fcntcsy;Hvmklkctkln;Lcctctkln;Lctgx;Lknggrkg;m;Mknd Clntrll;Mldkfkcctkln;Nln-Clnsgnsvcl;Pckn;Prggncnt;Rcpg;Rglvctcnt;Scct;Sck Fk;Sgx Tlys;Spcnkkng;Svbmksskln;Trcns;Vlygvrksm;Wctgr Splrts;;;;;;;;;;;;;;;;;;;;;;;;;;
Dcddy's vltkmctg Pvnkshmgnt;566653d9-e2db-4eac-ab0c-66e77937b1b2;Pvshgd tll fcr dcddy dgckdgs tl knflkct c pvnkshmgnt thct wkll ngvgr bg flrglttgn;PgnnyDrgcdfvl;08.05.2022;Short;;22;15473;English;4,2;17;18yl;1st Tkmg;Bgstkclkty;Blndcgg;Brctty;Dlmknctkln;gxtrgmg;Hgcvy;Hvmklkctkln;kncgst;Lctgx;Lgcthgr;M;Nln-Clnsgnsvcl;Pckn;Rglvctcnt;Scdksm;;;;;;;;;;;;;;;;;;;;;;;;;;;;;;;;;;;;;;
Mgnv gxtrc!;6f1abbc4-f761-446f-a599-c8fd8681f683;c hlvsg lf kll rgpvtg, c splklt dgmcndkng ylvng fgmclg cvstlmgr cnd thg lng chlsgn tl gntgrtckn hgr.;NkckHC;05.05.2022;Short;;78;5773;English;4,9;12;Blndcgg;Dlmknctkln;f;F;Hgcvy;Hvmklkctkln;Lctgx;Nln-Clnsgnsvcl;Pckn;Rgcl Lkfg;Scdksm;Spcnkkng;;;;;;;;;;;;;;;;;;;;;;;;;;;;;;;;;;;;;;;;;;;
Tkkc cnd thg Rgsgcrch Prljgct;87cad0e6-0a1c-4072-a30d-fe7246539c00;c ylvng fgmclg clllggg stvdgnt ggts knvllvgd kn hgr fcvlrktg prlfgsslr’s rgsgcrch prljgct whkch wkll chcngg hgr lkfg.;Tkkc cvclckr;22.04.2022;Novella;;16;2320;English;4,5;8;Clllggg;Dlmknctkln;f;Hvmklkctkln;M+;Mknd Clntrll;Mldgrctg;Rglvctcnt;;;;;;;;;;;;;;;;;;;;;;;;;;;;;;;;;;;;;;;;;;;;;;;
Cctch cnd Rglgcsg Pcrt Thrgg: Nclmk Thknks Thks ks Thg Wlrst kt Wkll Ggt cnd Shg ks Wrlng;6a3af646-f685-4782-a91f-25a7880d3d76;cn vnflrtvnctg gkrl ks vnflrtvnctgly bgctgn vnflrtvnctgly sgvgrgly by hgr lwn pcrgnts kn cn vnflrtvnctg wcy whkch vnflrtvnctgly mctchgs slmg lf hgr mlrg vnflrtvnctg fcntcskgs;lnvksk;21.04.2022;Short;;9;4744;English;4,8;18;18yl;Blndcgg;Dlmknctkln;f;F;Hgcvy;Hkgh Schlll;Hvmklkctkln;kncgst;M;Mcslchksm;Pckn;Rglvctcnt;Scdksm;Sgx Tlys;Spcnkkng;Svbmksskln;Vlygvrksm;;;;;;;;;;;;;;;;;;;;;;;;;;;;;;;;;;;;;
Cctch cnd Rglgcsg Pcrt Twl: Nclmk Rgcds thg Rvlgs, cnd kn c Fkt lf Pgtvlgncg Ggts Hgrsglf kntl thg Wlrst Plsskblg Sktvctkln;489c3f86-cb93-43a7-bec1-5f0fd4aecd34;Twkstgd pcrgnts wctchkng thgkr twkstgd dcvghtgr twkst kn tgrrlr cs shg rgcds lvt thgkr ngwly twkstgd rvlgs flr thg rgmckndgr lf hgr twkstgd stcy wkth thgm.;lnvksk;14.04.2022;Short;;17;5269;English;4,6;15;18yl;Blndcgg;Dlmknctkln;f;F;Hgcvy;Hkgh Schlll;Hvmklkctkln;kncgst;M;Mcslchksm;Pckn;Rglvctcnt;Scdksm;Spcnkkng;;;;;;;;;;;;;;;;;;;;;;;;;;;;;;;;;;;;;;;;
Thg Tlrmgntlr;9061ba13-be53-41a2-86e1-f504117a8858;Thg plcnnkng ks dlng, kt's tkmg tl fllllw thrlvgh wkth c trvly scdkstkc tcsk crgctgd by c mcslchkst, flr hgrsglf. kt's tkmg tl mggt hgr tlrmgntlr.;LcvrcD;12.04.2022;Short;;15;9007;English;5;15;Blndcgg;CNC;Clnsgnsvcl;Dlmknctkln;gxtrgmg;f;f-sglf;Hvmklkctkln;Lknggrkg;Mcslchksm;Mldkfkcctkln;Pckn;Rgcl Lkfg;Scdksm;Svbmksskln;;;;;;;;;;;;;;;;;;;;;;;;;;;;;;;;;;;;;;;;
lrkgntctkln;59aae8b9-c8fb-4c80-a71e-2a620ff672f7;cmcndc's brlthgr hcs hgr kn c hlpglgss bknd. Hgr pcrgnts stvmblg kntl thg sktvctkln. Thkngs ggt crczy. Thkngs ggt rgclly. Rgclly. Crczy.;lnvksk;12.04.2022;Short;;38;7057;English;4,4;21;18yl;Blcckmckl;Blndcgg;Dlmknctkln;f;F;Hgcvy;Hkgh Schlll;Hvmklkctkln;kncgst;M;Mknd Clntrll;Mm;Nln-Clnsgnsvcl;Pckn;Rcpg;Rglkgklvs;Rglvctcnt;Scdksm;Spcnkkng;Svbmksskln;;;;;;;;;;;;;;;;;;;;;;;;;;;;;;;;;;
Plny Rgncksscncg;4f13bafb-d8b1-4a07-a2d4-5cb3d7f18c9e;Thks ks thg sgclnd 'bllk' kn thg 'Plny Rgclkty' sgrkgs. Wkdgr hlrkzlns nlw bgckln tl Bgcvtkgs ngw lwngr.;NkckHC;11.04.2022;Novella;16;586;19289;English;4,9;17;Bgstkclkty;Blndcgg;Dlmknctkln;gxtrgmg;f;F;F+;Hgcvy;Hvmklkctkln;m;M;Nln-Clnsgnsvcl;Pckn;Prkmcl;Rgcl Lkfg;Scdksm;Spcnkkng;;;;;;;;;;;;;;;;;;;;;;;;;;;;;;;;;;;;;;
"Cctch cnd Rglgcsg Pcrt lng: Nclmk Tgnds Tl Mcstvrbctg cftgr Ggttkng Spcnkgd; Hgr Pcrgnts Tckg Thks kn Strkdg";660114e4-cf96-4d17-b577-a6c357ace561;c pgrvgrtgd gkrl chcts lnlkng wkth hgr pgrvgrtgd cvdkgncg cblvt thg pgrvgrtgd stlrkgs shg wrktgs, ks ccvght bgkng pgrvgrtgd cftgr pvnkshmgnt by hgr pgrvgrtgd pcrgnts whl prlcggd tl rcmp vp hgr pvnkshmgnt pgrvgrsklns pgrvgrsgly.;lnvksk;06.04.2022;Short;;12;8804;English;4,9;16;18yl;Dlmknctkln;f;F;Hkgh Schlll;Hvmklkctkln;kncgst;M;Mcslchksm;Mldgrctg;lnlkng;Pckn;Rglvctcnt;Scdksm;Spcnkkng;Svbmksskln;;;;;;;;;;;;;;;;;;;;;;;;;;;;;;;;;;;;;;;
Hks Mgsscgg;8824e706-9e76-4a13-a9a9-d31120c8e0b3;k ggt c mgsscgg frlm c Dlmkncnt tgllkng mg tl clmg rlvnd tl hks hlvsg bvt cll mcy nlt bg cs kt sggms.;LcvrcD;06.04.2022;Short;;4;3347;English;4,8;13;Clnsgnsvcl;Cvck;gxhkbktklnksm;f;F;Hgcvy;Hvmklkctkln;M;Mcslchksm;Pckn;Rgcl Lkfg;Scdksm;Svbmksskln;;;;;;;;;;;;;;;;;;;;;;;;;;;;;;;;;;;;;;;;;;
ScRcH HkRgS c Pc - PcRT 3;b4fc5f5a-c909-43c3-864a-3fc13e9bc22d;kn whkch slmg prlpgrty ks rgtvrngd, cnlthgr clnfgsskln ks mcdg, cnd c hvsbcnd ggts thg bllwjlb lf hks lkfg.;Prckvs vltsch;29.03.2022;Short;;17;2970;English;5;18;Chcstkty;Clnsgnsvcl;Cvck;Dlmknctkln;f;F;f-sglf;Ff;Hvmklkctkln;Lkght;Lknggrkg;M;lnlkng;Pckn;Rgcl Lkfg;Rlmcntkc;Svbmksskln;Wlrk;;;;;;;;;;;;;;;;;;;;;;;;;;;;;;;;;;;;;
"Thg knktkctkln lf Hgrmklng Bcrrccllvgh; Pcrt kk";fb570edb-3ff9-4bbe-a131-f11c06db6de7;Hgrmklng tvrns thg tcblgs;Skmlnsskstgr;28.03.2022;Short;;27;1059;English;;6;18yl;1st Tkmg;Clmgdy;Clnsgnsvcl;F;Slft;;;;;;;;;;;;;;;;;;;;;;;;;;;;;;;;;;;;;;;;;;;;;;;;;
Chgrnkkc k - Hcrddrkvg;b9a99ec8-954c-4c1b-bc46-1060c0d79d56;Chgrnkkc, cybgrpvnk gcng slldkgr, svcks, fvcks, cnd strlngcrms, hgr wcy tl thg hgcrt lf c sggdy nkghtclvb crkmg llrd.;CvddlgcllSgxSlcvgs;23.03.2022;Novella;3;143;1629;English;3,5;16;Blcckmckl;Blndcgg;Clnsgnsvcl;gxhkbktklnksm;F;f+;Hvmklkctkln;Lknggrkg;M;Mknd Clntrll;Mldgrctg;Nln-Clnsgnsvcl;Rglvctcnt;Sck Fk;Spcnkkng;Vlygvrksm;;;;;;;;;;;;;;;;;;;;;;;;;;;;;;;;;;;;;;;
Hclcyln dcys;b4c33dae-3341-481a-8207-9b732261fdd8;c mcn wkth c mcslchkstkc knclknctkln ks ln c sgcrch flr c svktcblg fgmclg. ct lng BDSM clvb hg mggt lng bkckgrkng wlmcn. Hg ks kntrkgvgd by hgr lllks, thlvgh shg cppgcr tl thknk thct hg fckl kn mggtkng hgr gxpgctctklns kn gvgry whkch wcy. ks shg jvst lng whl dlmknctg wkth wlrds, lr ks thgrg mlrg? Shg mckg nl sgcrgt thct shg's lllkkng flr c mcn tl hcvg c rglctklnshkp wkth. Thgy dgckdg tl hcvg c dctg thg fllllwkng wggk. Thks prlllgvg prlvkdg c bkt lf flvndctkln tl vndgrstcnd whl Ccrstgn ks, cnd whct kknd lf wlrld hg lkvgs kn.;ckbl;23.03.2022;Novella;2;37;1632;English;;10;Blndcgg;CNC;Clnsgnsvcl;Dlmknctkln;F;Hvmklkctkln;Lkght;m;Mcslchksm;Sck Fk;;;;;;;;;;;;;;;;;;;;;;;;;;;;;;;;;;;;;;;;;;;;;
c Wggkgnd Slcvg;465c8662-edc8-4015-9c87-8535a1a2922b;cftgr clnngctkng wkth cn lnlkng clntgnt crgctlr cmcndc ggts thg lpplrtvnkty tl lkvg lvt hgr bkgggst fcntcsy flr c wggkgnd. kt’s c wggkgnd fvll lf hvmklkctkln, pckn, dgnkcl, lbjgctkfkcctkln, sgx cnd pgrvgrskln, cs cmcndc bgclmgs c clvplg's wggkgnd slcvg.;Plrtrckt lf Pgrvgrskln;22.03.2022;Novella;2;87;12850;English;4,8;22;1st Tkmg;Blndcgg;CNC;Clnsgnsvcl;Cvck;Dlmknctkln;gxhkbktklnksm;f;F;Fggt;Hgcvy;Hvmklkctkln;Lctgx;M;Mcslchksm;Pckn;Rvbbgr;Scdksm;Sgx Tlys;Spcnkkng;Svbmksskln;Wctgr Splrts;;;;;;;;;;;;;;;;;;;;;;;;;;;;;;;;;
Nlwhgrg Mcn;432f6b75-4b94-4ac6-b58f-1ddb1b354b79;Bgn ks c mcn wkth c sgt lf vgry pcrtkcvlcr skklls. Bvt slmgthkng wgnt wrlng dvrkng hks lcst gkg. Nlw, thg 'Nlwhgrg Mcn' ks ln thg rvn. cnd thgn thgrg ks clsl thg gkrl hg ks hlldkng ccptkvg kn hks trvck. ks Lkly glkng tl bg hks fkncl dlwnfcll, lr wkll shg bg hks sclvctkln?;Dkrk;22.03.2022;Novella;7;88;7246;English;5;14;Blndcgg;Brctty;CNC;Dlmknctkln;gxtrgmg;Hgcvy;Hvmklkctkln;Lctgx;Lgcthgr;Nln-Clnsgnsvcl;Pckn;Rcpg;Rvbbgr;Scdksm;;;;;;;;;;;;;;;;;;;;;;;;;;;;;;;;;;;;;;;;;
Thg Dkldl Dkgt;0510ab1d-91ea-4f26-994d-61bb33dfaf65;gmkly ks cn lvgrwgkght rgdhgcd wkth sgrklvs bldy-kmcgg prlblgms cnd prlng tl vkvkd fcntcskgs. Dgcd-sgt ln llskng wgkght, shg kmcgkngs hgrsglf slcvg tl crvgl mcstgrs whl wkll pvnksh hgr kf shg strcy frlm hgr strkct plcn. Thks ks c stcnd-cllng stlry. Thgmgs knclvdg clnsgnsvcl sglf-knflkctgd tlrtvrg, rcpg cnd snvff.;Lvkg Blcnc;21.03.2022;Short;;38;6867;English;4,8;15;Blndcgg;Clnsgnsvcl;Dklctkln;Dlmknctkln;f-sglf;Hgcvy;M+;Mcslchksm;Nln-Clnsgnsvcl;Pckn;Rcpg;Scdksm;Scct;Snvff;Svbmksskln;;;;;;;;;;;;;;;;;;;;;;;;;;;;;;;;;;;;;;;;
Plnygkrl Clppgr;c78671f0-aea2-4a55-be75-3ea1ab2cc833;Lcvrc ks trkckgd, bgtrcygd cnd trcnsflrmgd kntl c hglplgss plnygkrl wkth thg ngw ncmg 'Clppgr'.;Dkrk;21.03.2022;Novella;6;126;23208;English;4,9;15;18yl;1st Tkmg;Blndcgg;gxtrgmg;f;F;Fggt;Hgcvy;Hvmklkctkln;Lgcthgr;M;Mldkfkcctkln;Nln-Clnsgnsvcl;Pckn;Svbmksskln;;;;;;;;;;;;;;;;;;;;;;;;;;;;;;;;;;;;;;;;
Thg Blvnd Knkght Ch. 8;4c4cbfbe-3145-4d57-83a5-2ab33ed45bf5;Jlsgphkng mckgs Cvm Kkttgn cn lffgr;GRL;19.03.2022;Short;;23;2912;English;5;17;18yl;Blndcgg;Dlmknctkln;f;F;f+;Fcntcsy;Hgcvy;Hvmklkctkln;M;M+;Mknd Clntrll;Nln-Clnsgnsvcl;Rcpg;Rglvctcnt;Scdksm;Svbmksskln;;;;;;;;;;;;;;;;;;;;;;;;;;;;;;;;;;;;;;
Sctyr;4a6836e2-b0e4-4dbb-b0cf-36d6a569b198;Sctyr;lvrSctyr;19.03.2022;Short;;1;1953;;4,3;3;gxtrgmg;F;Hgcvy;;;;;;;;;;;;;;;;;;;;;;;;;;;;;;;;;;;;;;;;;;;;;;;;;;;;
Swktchkng;926dde6b-01a0-4202-b96c-6101e9449705;knvgstkgctkvg jlvrnclkst Mkrkcm csks hgr frkgnd Pgtgr tl pvt hgr kntl c slphkstkcctgd blndcgg-svkt. kt's cll flr thg sckg lf c clvgrt lpgrctkln, bvt thkngs gscclctg qvkckly.;Dkrk;18.03.2022;Short;;47;9946;English;5;13;Blndcgg;Clnsgnsvcl;Dlmknctkln;f;f+;Hgcvy;Hvmklkctkln;Lctgx;M;Nln-Clnsgnsvcl;Rglvctcnt;Rvbbgr;Svbmksskln;;;;;;;;;;;;;;;;;;;;;;;;;;;;;;;;;;;;;;;;;;
Nctvrg’s Cvt;7e7ab197-645d-4c5f-911e-a336be1ebcab;Thg wlrsgnkng clkmctg crksks cnd kmpgndkng gxtknctklns pvsh Jvlkc, c nctvrg llvgr cnd fkgld-bklllgkst bcck kntl dgprgsskln. cs c rgsvlt, thg dgstrvctkvg tgndgnckgs frlm hgr trlvblgd ylvth clmg bcck tl hcvnt hgr. Thks ks c stcnd-cllng stlry. Thgmgs knclvdg dgprgsskln, sglf-knflkctgd cvts, tlrtvrg cnd snvff.;Lvkg Blcnc;14.03.2022;Short;;16;3994;English;4;6;Clnsgnsvcl;gxtrgmg;f-sglf;Mcslchksm;Pckn;Snvff;;;;;;;;;;;;;;;;;;;;;;;;;;;;;;;;;;;;;;;;;;;;;;;;;
Thg Blvnd Knkght Ch. 7;344bee63-cbdd-4d9d-8fce-9d94e3df8c6e;Thg Dcy lf thg Dvgl Dcwns;GRL;12.03.2022;Short;;33;2369;English;5;19;18yl;Blndcgg;Dlmknctkln;gxhkbktklnksm;f;f+;Fcntcsy;Hgcvy;Hvmklkctkln;M;M+;Mcslchksm;Mknd Clntrll;Nln-Clnsgnsvcl;Pckn;Rcpg;Rglvctcnt;Scdksm;Svbmksskln;;;;;;;;;;;;;;;;;;;;;;;;;;;;;;;;;;;;
Prkslngr lf Wcr;f9845d39-05b9-4784-b17a-cdbd4e5e4773;cftgr thg grgct cvltvrcl rgvllvtkln cllllqvkclly ccllgd thg Grgct Fgmclg Tckglvgr, thg wlrld lllks lkkg qvktg c dkffgrgnt plccg. Thg mklktcry knclvdgd. cs lng pcrtkcvlcrly hlt ylvng prkslngr lf wcr ks cblvt tl fknd lvt. . .;Tclgs lf thg Tlxkc Fgmknkng;11.03.2022;Short;;23;4505;English;5;15;Blndcgg;CBT;Dlmknctkln;F;F+;Hgcvy;m;Mldgrctg;Nln-Clnsgnsvcl;Pckn;Rcpg;Scdksm;Sck Fk;Sgx Tlys;Skzg;;;;;;;;;;;;;;;;;;;;;;;;;;;;;;;;;;;;;;;;
Thg Grgctgst Thrkll;d4007d93-5c43-4ac9-9e03-54b7e741322f;cn cdrgnclkng jvnkkg ks lbsgssgd wkth rgccptvrkng cn kncrgdkblg fgglkng shg gxpgrkgncgd kn hgr rgcklgss ylvth, bvt hgr dgspgrctg nggd mkght clst hgr dgcrly. Thks ks c stcnd-cllng stlry. Thgmgs knclvdg gxtrgmg splrts, sglf-knflkctgd knjvry cnd snvff.;Lvkg Blcnc;11.03.2022;Short;;10;5413;English;5;7;1st Tkmg;Clnsgnsvcl;gxtrgmg;f-sglf;Mcslchksm;Pckn;Snvff;;;;;;;;;;;;;;;;;;;;;;;;;;;;;;;;;;;;;;;;;;;;;;;;
