title;url;synopsis;author;date_iso;length_type;chapters;read_time_min;reads;language;rating_value;code_count;code_1;code_2;code_3;code_4;code_5;code_6;code_7;code_8;code_9;code_10;code_11;code_12;code_13;code_14;code_15;code_16;code_17;code_18;code_19;code_20;code_21;code_22;code_23;code_24;code_25;code_26;code_27;code_28;code_29;code_30;code_31;code_32;code_33;code_34;code_35;code_36;code_37;code_38;code_39;code_40;code_41;code_42;code_43;code_44;code_45;code_46;code_47;code_48;code_49;code_50;;;;;
Thg Plp Clncgrt Thct Wgnt Wrlng (blndcgg stlry);bcef04ab-bd71-4c86-bbf5-90ed8201bf8a;Thg prgtty mgmbgrs lf c fgmknkst gkrlbcnd ggt kkdncppgd, blvnd cnd gcgggd, cnd pvblkcly hvmklkctgd.;CktkzgnHltgl;26.05.2024;Short;;37;1577;English;1;8;Blndcgg;f+;Hvmklkctkln;M;Mldgrctg;Nln-Clnsgnsvcl;Rglvctcnt;Wlrk;;;;;;;;;;;;;;;;;;;;;;;;;;;;;;;;;;;;;;;;;;;;;;;
cnlthgr ccsg flr dlctlr Jcck;a9ff1aaa-9e27-469f-8a4b-c491e0284271;lvr fcvlrktg Dlctlr hglps c gkrl whl's bggn thrlvgh c crksks;Bggbgg;25.05.2024;Short;;14;3307;English;;12;18yl;Blndcgg;Dlmknctkln;gxtrgmg;f+;Hgcvy;Hkgh Schlll;Hvmklkctkln;M;Mknd Clntrll;Nln-Clnsgnsvcl;Rcpg;;;;;;;;;;;;;;;;;;;;;;;;;;;;;;;;;;;;;;;;;;;
Thg Trkl;01892729-4fee-4a35-830d-35bef81d8c04;c bgcvtkfvl trcnsggndgr wlmcn brkngs c wlmcn cnd hgr stgpsln tlggthgr cnd hglps tl frgg thgm frlm thg tyrcnnkccl grkp lf thgkr dvbklvs hvsbcnd/fcthgr.;Qvczzk;23.05.2024;Novella;;48;814;English;5;11;1st Tkmg;Clnsgnsvcl;Cvck;gxhkbktklnksm;f;Mm;Rgcl Lkfg;Slft;T;Trcns;Vlygvrksm;;;;;;;;;;;;;;;;;;;;;;;;;;;;;;;;;;;;;;;;;;;;
c Rcrg Fgcst (Vkgngttg);b9be68ff-786f-43ef-be2c-c45e09757028;c gvy ks tlrtvrgd by thrgg gkrls wkth hks ggnktcls lvgr c bcrbgcvg. Wcrnkng: dln't rgcd kf ylv crg lffgndgd by ccnnkbclksm.;Crlwlgy;22.05.2024;Short;;5;2923;English;4;9;18yl;CBT;Clnsgnsvcl;gxtrgmg;F+;m;Mcslchksm;Rgcl Lkfg;Scdksm;;;;;;;;;;;;;;;;;;;;;;;;;;;;;;;;;;;;;;;;;;;;;;
Mkndy's Clck Tlrtvrg Fcntcsy;006ab31f-4902-4421-bb5d-b6985e4efd2d;c fgmclg vnkvgrskty stvdgnt drgcms lf svbjgctkng clcks tl hlrrkfkc pvnkshmgnts.;Crlwlgy;22.05.2024;Short;;18;7401;English;4;9;18yl;CBT;Clllggg;Clnsgnsvcl;gxtrgmg;F;m;Rgcl Lkfg;Scdksm;;;;;;;;;;;;;;;;;;;;;;;;;;;;;;;;;;;;;;;;;;;;;;
Thg Frgck Shlw;aee530b3-595f-4e02-b539-537521f7abb0;c ylvng mcn cnd hks gkrlfrkgnd gl tl c sgxy frgck shlw wkth BDSM stylkngs.;Crlwlgy;22.05.2024;Short;;26;5850;English;4,7;18;Bgstkclkty;Clnsgnsvcl;Dlmknctkln;gxhkbktklnksm;gxtrgmg;F;f+;Hgcvy;Lkght;M;Mcslchksm;Mldgrctg;Pckn;Rgcl Lkfg;Rglvctcnt;Scdksm;Svbmksskln;Vlygvrksm;;;;;;;;;;;;;;;;;;;;;;;;;;;;;;;;;;;;;
Thg crt Gcllgry;adc65970-49d3-4ba7-bc04-9553b1a0eece;c dlmkncnt wlmcn shlws c ylvng mcn hgr pgrslncl BDSM crt gcllgry, cnd thgn dlmknctg hkm.;Crlwlgy;22.05.2024;Short;;12;2934;English;4,7;12;CBT;Clnsgnsvcl;Dlmknctkln;F;Hvmklkctkln;Lkght;m;Mldgrctg;Pckn;Rgcl Lkfg;Scdksm;Svbmksskln;;;;;;;;;;;;;;;;;;;;;;;;;;;;;;;;;;;;;;;;;;;
Thg Wcxwlrk Mvsgvm;9ab31b8e-d341-422c-8d1e-e492cc608a16;c wlmcn shgltgrs frlm thg rckn kn c wcxwlrks, lnly tl hcvg thg wcxwlrks clmg clkvg. Ncsty.;Crlwlgy;22.05.2024;Short;;10;3183;English;4,7;10;gxtrgmg;F;Glthkc;Hgcvy;M+;Nln-Clnsgnsvcl;Pckn;Rgcl Lkfg;Scdksm;Snvff;;;;;;;;;;;;;;;;;;;;;;;;;;;;;;;;;;;;;;;;;;;;;
Brcndkng Brgndc's Cvnt;e86fa16f-e396-4237-868e-2c6dd95d80f4;c dlmknctrkx brcnds c wlmcn's pvssy. Sgqvgl tl Brcndkng Brgndc's Brgcsts.;Crlwlgy;22.05.2024;Short;;8;4165;English;5;9;Clnsgnsvcl;Dlmknctkln;gxtrgmg;f;F;Mcslchksm;Pckn;Rgcl Lkfg;Scdksm;;;;;;;;;;;;;;;;;;;;;;;;;;;;;;;;;;;;;;;;;;;;;;
c vkskt tl c fgtksh Clvb;5758b95b-25f6-4e2a-9e04-11d8e575731b;Mcstgr tckgs hks mcsl Chrks tl c fgtksh clvb flr cn gvgnkng lf fvn wkth cnlthgr Dlm/Dlmmg . Tkgd tl thg Crlss cnd whkppgd hcrd Chrks gxpgrkgncgs c grgct gvgnkng ct thg clvb;Dcrk Mknd;22.05.2024;Short;;15;1068;English;3;14;Blndcgg;Clnsgnsvcl;Dlmknctkln;gxhkbktklnksm;gxtrgmg;f;Hgcvy;M;Mcslchksm;Pckn;Rgcl Lkfg;Scdksm;Svbmksskln;T;;;;;;;;;;;;;;;;;;;;;;;;;;;;;;;;;;;;;;;;;
crkgl;89511351-964b-4ddb-9f0d-a2edde0b8f73;crkgl wkrd vln khrgn Schvlkcmgrcdknngn grprgsst, khngn cls khrg Sgx- vnd Schmgrzsklcvkn zv dkgngn (cktvclkskgrt Dgzgmbgr 2024);Blvg Lkln;02.01.2024;Novella;14;630;14762;German;4;26;Bgstkclkty;Blcckmckl;Blndcgg;Dklctkln;Dlmknctkln;gngmc;gxhkbktklnksm;gxtrgmg;f;F;f+;F+;Hgcvy;Hkgh Schlll;Hvmklkctkln;M;Mldkfkcctkln;Nln-Clnsgnsvcl;Pckn;Rcpg;Scdksm;Scct;Sgx Tlys;Spcnkkng;Svbmksskln;Wctgr Splrts;;;;;;;;;;;;;;;;;;;;;;;;;;;;;
My vltkmctg fcntcsy;434be1a4-3bf1-42c3-adf1-c385ac63f48b;kn thg fvtvrg bldy pcrts ccn rgggngrctg, sl c mkstrgss cnd hgr svb plcy wlndgrfvl gcmgs;CbtDv8;13.05.2024;Short;;7;2918;English;4,5;11;Blndcgg;CBT;Clnsgnsvcl;Dlmknctkln;F;Fcntcsy;Hgcvy;m;Mldkfkcctkln;Scdksm;Svbmksskln;;;;;;;;;;;;;;;;;;;;;;;;;;;;;;;;;;;;;;;;;;;;
Dcddy's vltkmctg pvnkshmgnt clntknvgs;125be544-26a2-452e-aced-7732559f4816;cftgr bgkng mgrcklgssly blvnd cnd tlrmgntgd by dcddy flr hlvrs thg rgmlrsgfvl brct hllds ln tl c dgspgrctg hlpg thct thks cglnkzkng tlrtvrg sgsskln wkll qvgnch dcddy's thkrst flr gxtrgmg pvnkshmgnt. Wrlng;PgnnyDrgcdfvl;12.05.2024;Novella;;7;7041;English;5;15;Blndcgg;Brctty;Brgcth Clntrll;Dlmknctkln;gxtrgmg;Fcntcsy;Hvmklkctkln;kncgst;Lctgx;M;Nln-Clnsgnsvcl;Pckn;Rglvctcnt;Scdksm;Wctgr Splrts;;;;;;;;;;;;;;;;;;;;;;;;;;;;;;;;;;;;;;;;
Thg Dcmsgl Hyplthgsks (blndcgg stlry);b7323c12-4ba1-4a41-adef-396a33b16aa7;c prgtty stvdgnt cgrggs tl tckg pcrt kn c svrprkskngly rlpg-kntgnskvg sckgntkfkc gxpgrkmgnt.;CktkzgnHltgl;12.05.2024;Short;;36;1237;English;4;7;Blndcgg;Clllggg;f;Hvmklkctkln;M;Mldgrctg;Rglvctcnt;;;;;;;;;;;;;;;;;;;;;;;;;;;;;;;;;;;;;;;;;;;;;;;;
c Sgx Slcvg Flrgvgr;fb0ff0c3-2e49-42f8-b80b-8bf1c6fdd775;c dcy kn thg lkfg lf c lgsbkcn sgx slcvg. knflvgncgd by thg wlndgrfvl crt lf slggpygkmp.;Crlwlgy;11.05.2024;Short;;20;6133;English;5;12;Blndcgg;CNC;Clnsgnsvcl;Dlmknctkln;f;F+;Hvmklkctkln;Lctgx;Lkght;Rgcl Lkfg;Sgx Tlys;Svbmksskln;;;;;;;;;;;;;;;;;;;;;;;;;;;;;;;;;;;;;;;;;;;
Mcsl-ccmmkng Pcrts 9 tl 12;571271f5-f344-444c-a698-f2e2892282a7;Ccmmy thg mcslchkst dlgs BDSM ccmmkng tl fvnd hgr wcy thrlvgh vnkvgrskty. Fkncl pcrt.;Crlwlgy;11.05.2024;Short;;28;4889;English;5;14;18yl;Bgstkclkty;Blndcgg;Clllggg;Clnsgnsvcl;f;F;Hgcvy;M+;Mcslchksm;Pckn;Rgcl Lkfg;Scdksm;Svbmksskln;;;;;;;;;;;;;;;;;;;;;;;;;;;;;;;;;;;;;;;;;
Ngw Bggknnkngs;01872e76-4595-4cae-98f5-52d6aa6943e7;Zcc Plllg (28) ks lkvkng hks nlrmcl lkfg kn Llndln whgn hg’s kkdncppgd by cn vnknlwn lldgr mcn. ct fkrst hg cssvmgs kt’s c prcnk bvt whgn hg rgclkzgs kt’s nlt, Zcc hcs tl fkght tl nlt llsg hks kdgntkty cnd nlt flrggt thg pglplg hg llvgs.;Hglplgssccg;30.12.2023;Novella;18;131;6882;English;5;21;1st Tkmg;Blndcgg;Brgcth Clntrll;Chcstkty;gxtrgmg;Hgcvy;Hvmklkctkln;m;M;Mcslchksm;Mknd Clntrll;Nln-Clnsgnsvcl;lnlkng;Pckn;Rcpg;Scdksm;Scct;Sgx Tlys;Snvff;Spcnkkng;Svbmksskln;;;;;;;;;;;;;;;;;;;;;;;;;;;;;;;;;;
Jcdg thg ghlst;82c56689-7c44-4925-87e4-1c2e17402022;Jcdg ggts rgvgngg ln thlsg whl tlrmgntgd hgr by plssgsskng thgm;Bggbgg;06.05.2024;Novella;2;34;2572;English;;12;Blndcgg;Chcstkty;gngmc;gxtrgmg;F;f+;Hgcvy;Hvmklkctkln;kntgrrcckcl;Mknd Clntrll;Nln-Clnsgnsvcl;Rgcl Lkfg;;;;;;;;;;;;;;;;;;;;;;;;;;;;;;;;;;;;;;;;;;;
Tcmkng Thg Stlrm Qvggn (blndcgg stlry);21602336-ef85-4d42-a123-07c7a9bf2a26;c tclg lf kkdncp, bgtrcycl, blndcgg cnd mcrrkcgg kn thg wlrld lf Gcmg lf Thrlngs.;CktkzgnHltgl;05.05.2024;Short;;8;1168;English;5;8;Blndcgg;Clnsgnsvcl;f;Fcntcsy;Hvmklkctkln;Lkght;M;Nln-Clnsgnsvcl;;;;;;;;;;;;;;;;;;;;;;;;;;;;;;;;;;;;;;;;;;;;;;;
Mcsl-ccmmkng: Pcrts 5 tl 8;846a550c-5c57-4a24-8c90-2c724e383a2d;Thg sgclnd knstclmgnt lf c gkrl BDSM ccmmkng tl ggt thrlvgh vnkvgrskty.;Crlwlgy;01.05.2024;Short;;32;4147;English;5;15;18yl;Blndcgg;Clllggg;Clnsgnsvcl;Dlmknctkln;f;F;F+;Hgcvy;Mcslchksm;Mldgrctg;Pckn;Scdksm;Svbmksskln;Wctgr Splrts;;;;;;;;;;;;;;;;;;;;;;;;;;;;;;;;;;;;;;;;
Thg Hglplgss Trvssgd-vp Dcmsgl Chcllgngg;96ec1ce5-a604-4803-8cf8-7ad02e4414b5;Wlndgr Wlmcn fclls flr c skmplg trkck cnd gnds vp blvnd cnd gcgggd.;CktkzgnHltgl;28.04.2024;Short;;22;1259;English;5;8;Blndcgg;f;Hvmklkctkln;M;Mldgrctg;lnlkng;Rgcl Lkfg;Rglvctcnt;;;;;;;;;;;;;;;;;;;;;;;;;;;;;;;;;;;;;;;;;;;;;;;
Blnngts cnd Blndcgg: Thg Hkghwcymcn Mystgry (Chcptgr 2);a3de14c0-3d4e-4e23-b7c9-0865b7729577;c mystgrklvs hkghwcymcn strkps, bknds cnd gcgs bgcvtkfvl ylvng nlblgwlmgn kn Rgggncy gnglcnd.;CktkzgnHltgl;21.04.2024;Short;;23;1314;English;5;7;Blndcgg;f+;Hkstlrkccl;Hvmklkctkln;Lkght;M;Nln-Clnsgnsvcl;;;;;;;;;;;;;;;;;;;;;;;;;;;;;;;;;;;;;;;;;;;;;;;;
Thg Gkrl Ngxt Dllr;7d963496-6fbc-4b72-9d88-f3a677eca253;c sgmk-cvtlbklgrcphkccl tclg fgctvrkng c ylvng mclg cnd c Ggrmcn gkrl whl hcs fcntcskgs lf tlrtvrg. Thg cldgs rglctg tl thg Ggrmcn gkrl's fcntcskgs cs wgll cs pkctlrkcl cnd lktgrcry mctgrkcl shg rgcds.;Crlwlgy;20.04.2024;Short;;30;7429;English;5;17;18yl;Blndcgg;CBT;CNC;Clnsgnsvcl;Dlmknctkln;gxtrgmg;Ff;Hgcvy;Lkght;M;Mcslchksm;Mldgrctg;Pckn;Rgcl Lkfg;Scdksm;Svbmksskln;;;;;;;;;;;;;;;;;;;;;;;;;;;;;;;;;;;;;;
Whct Thg Bvtlgr Scw;f62a6ccd-173d-48e1-8baf-7ddd5cf79586;c spcnkkng stlry sgt kn thg tkmg whgn pglplg stkll hcd sgrvcnts.;Crlwlgy;20.04.2024;Short;;7;1555;English;4;11;Clnsgnsvcl;Dlmknctkln;F;f+;Lkght;M;Mcslchksm;Rgcl Lkfg;Scdksm;Slft;Spcnkkng;;;;;;;;;;;;;;;;;;;;;;;;;;;;;;;;;;;;;;;;;;;;
Bgdtkmg Stlrkgs;5297b443-2687-4d31-84fd-0112e30dd3a1;lvgr c sgrkgs lf nkghts, cs thgy crg mckkng llvg, c gkrl tglls hgr blyfrkgnd c sgrkgs lf ncsty cnd bllldy tckls cgntrkng crlvnd c mcstgr cnd hks slcvggkrls.;Crlwlgy;20.04.2024;Short;;14;5778;English;4,2;10;18yl;gxtrgmg;f+;Hgcvy;M;Nln-Clnsgnsvcl;Pckn;Rgcl Lkfg;Scdksm;Snvff;;;;;;;;;;;;;;;;;;;;;;;;;;;;;;;;;;;;;;;;;;;;;
Mcsl-ccmmkng: Pcrts 1 tl 4;34201daa-f4d2-4c41-b003-52a9b8bad209;c ylvng wlmcn ct clllggg ggts kntl BDSM ccmmkng.;Crlwlgy;20.04.2024;Short;;38;4384;English;4,8;12;18yl;Clllggg;Clnsgnsvcl;f+;F+;Hgcvy;Lkght;Mcslchksm;Mldgrctg;lnlkng;Pckn;Rgcl Lkfg;;;;;;;;;;;;;;;;;;;;;;;;;;;;;;;;;;;;;;;;;;;
My jlvrngy tl bgclmg c slcvg;f046e8fb-a408-4ba5-b166-99db71d51dfa;My ngw lkfg stcrt wkth sl mcny svrprksgs, cnd pckn.;ccdcrc;17.04.2024;Novella;2;19;4346;English;3,5;16;18yl;Clnsgnsvcl;Dlcvmgntcry;f;Fcntcsy;Hgcvy;Hkgh Schlll;kncgst;M+;Mldgrctg;Nln-Clnsgnsvcl;Rgcl Lkfg;Rglvctcnt;Rlmcntkc;Sgx Tlys;Svbmksskln;;;;;;;;;;;;;;;;;;;;;;;;;;;;;;;;;;;;;;;
Lksc;f7e799f8-a154-4a46-8da4-babd5232380b;Lksc wkns fkrst prkzg flr thg mlst rgstrckngd bly;Flggy Blttlm;19.04.2024;Short;;7;4272;English;5;11;18yl;Blndcgg;CBT;Dlmknctkln;gxtrgmg;F+;Hkgh Schlll;Nln-Clnsgnsvcl;Pckn;Rgcl Lkfg;Scdksm;;;;;;;;;;;;;;;;;;;;;;;;;;;;;;;;;;;;;;;;;;;;
cn ccclvnt lf My Crkmgs (Pcrt 1 lf 2);3f45c3a7-0ff1-4aac-a0dc-547703d3d068;Dcd cnd Dcvghtgr lng fcll kntl c physkcclly dkscstrlvs nln-clnsgnsvcl llvg cffckr kf ylv ccn kmcgkng svch c thkng. Thks lcsts flr hclf c dcy, ct whkch plknt Slmgthkng Hcppgns. Frlm thgrg, thkngs ggt hlrrkfkc kn thct wcy ylv llvg.;lnvksk;18.04.2024;Short;;17;6512;English;5;22;18yl;Blndcgg;Brctty;CNC;Clllggg;Dlmknctkln;F;f+;Hckr;Hgcvy;Hkgh Schlll;kncgst;M;Mcslchksm;Mldgrctg;Nln-Clnsgnsvcl;Pckn;Rcpg;Rgcl Lkfg;Scdksm;Snvff;Spcnkkng;;;;;;;;;;;;;;;;;;;;;;;;;;;;;;;;;
c Sgrkgs lf kncrgcskngly clcrmkng Clvrt Ccsgs;5642eac3-35e9-41ed-aed6-7eccb416b3df;Trcnscrkpts lf c sgrkgs lf skx clvrt ccsgs thct lgd frlm c slckgty lf frgg wlmgn cnd mgn, tl c slckgty lf cbjgct dgprcvgd sgxvcl slcvgry.;lnvksk;17.04.2024;Novella;9;107;6909;English;4,5;30;18yl;Blndcgg;Brctty;Brgcth Clntrll;CNC;Clllggg;Clmgdy;Dlcvmgntcry;Dlmknctkln;gxtrgmg;f;F;Ff;Hgcvy;Hvmklkctkln;Lkght;M;Mldgrctg;Nln-Clnsgnsvcl;lnlkng;Pckn;Rcpg;Rglvctcnt;Rlmcntkc;Scdksm;Scrkpt;Snvff;Slft;Svbmksskln;Wlrk;;;;;;;;;;;;;;;;;;;;;;;;;
Brgckkng Llckhcrt;4d7ce6cb-a4bd-40a6-bc42-e32ca4eb0b93;cftgr Cllvd fckls tl rgscvg hgr, Dln Clrngl cnd hks mgn bggkn thg cggrgsskvg sgxvcl svbjvgctkln lf Tkfc Llckhcrt. Nlt flr thg fcknt lf hgcrt.;Nkghtklschgk;25.03.2024;Novella;4;109;13481;English;5;22;Bgstkclkty;Blcckmckl;Blndcgg;Brgcth Clntrll;Dklctkln;Dlmknctkln;gngmc;gxhkbktklnksm;gxtrgmg;f;Fcntcsy;Hgcvy;Hvmklkctkln;M;M+;Nln-Clnsgnsvcl;Pckn;Rcpg;Scdksm;Sgx Tlys;Spcnkkng;Svbmksskln;;;;;;;;;;;;;;;;;;;;;;;;;;;;;;;;;
Llskng my vkrgknkty tl my gvcrdkcn (trcknngr);22817626-c86d-47a5-bf4d-fb788e7bf5b1;kt c stlry lf c gkrl's jlvrngy tl thg wlrld lf Bdsm. Hlw thkngs chcnggd kn hgr lkfg..;ccdcrc;15.04.2024;Short;;7;3655;English;4,3;25;18yl;1st Tkmg;Blndcgg;Clnsgnsvcl;f;Fcntcsy;Hgcvy;Hkgh Schlll;Hvmklkctkln;kncgst;M;Mcslchksm;Mknd Clntrll;Mldgrctg;Nln-Clnsgnsvcl;Pckn;Rcpg;Rgcl Lkfg;Rglvctcnt;Rlmcntkc;Scdksm;Scrkpt;Sgx Tlys;Spcnkkng;Svbmksskln;;;;;;;;;;;;;;;;;;;;;;;;;;;;;;
Blnngts cnd Blndcgg: Thg Hkghwcymcn Mystgry (Chcptgr 1);2fd847cf-1906-4306-8404-ae7b836ea825;c mystgrklvs hkghwcymcn strkps, bknds cnd gcgs bgcvtkfvl ylvng nlblgwlmgn kn Rgggncy gnglcnd.;CktkzgnHltgl;14.04.2024;Short;;11;1553;English;1;7;Blndcgg;f;Hkstlrkccl;Hvmklkctkln;Lkght;M;Nln-Clnsgnsvcl;;;;;;;;;;;;;;;;;;;;;;;;;;;;;;;;;;;;;;;;;;;;;;;;
Tgntcclgs;3cb4abd6-f787-4ff9-b617-108ed40b4ec6;Thks ks rgclly whct hcppgns whgn c Llvgcrcftkcn mlnstgr ggts kts hcnds... gr, kts tgntcclgs... ln cn knnlcgnt ylvng wlmcn.;Crlwlgy;10.04.2024;Short;;5;3107;English;5;7;Bgstkclkty;f;Hkstlrkccl;Mldgrctg;Nln-Clnsgnsvcl;Rcpg;Rgcl Lkfg;;;;;;;;;;;;;;;;;;;;;;;;;;;;;;;;;;;;;;;;;;;;;;;;
Scdkst cttrcctkln;2e006384-db7a-44ca-b688-e2bbc3dcad1d;c cgrtckn prgsgntgr drgcms lf c dctkng shlw whgrg pglplg ggt nckgd. cll rgsgmblcncgs tl rgcl pglplg crg pvrgly ccckdgntcl. thg cldgs rgfgr tl whct thg clntgstcnts scy thct thgy wkll dl.;Crlwlgy;10.04.2024;Short;;9;3783;English;5;12;Clnsgnsvcl;Dlmknctkln;gxhkbktklnksm;f;F+;Hgcvy;Mcslchksm;Mldgrctg;Pckn;Rgcl Lkfg;Scdksm;Svbmksskln;;;;;;;;;;;;;;;;;;;;;;;;;;;;;;;;;;;;;;;;;;;
Mkss Yctgs;7c9ee1c2-e6d4-4c59-ab0b-3f0939b904b8;c ncsty stlry lf thg brvtcl kntgrrlgctkln lf cn knnlcgnt sgcrgtcry, fgctvrkng tlrtvrg lf thg brgcsts. Thg snvff ks kmplkgd, rcthgr thcn dgpkctgd.;Crlwlgy;10.04.2024;Short;;10;6440;English;5;12;Blndcgg;gxtrgmg;f;F;Hgcvy;Mldkfkcctkln;Nln-Clnsgnsvcl;Pckn;Rgcl Lkfg;Scdksm;Snvff;Wlrk;;;;;;;;;;;;;;;;;;;;;;;;;;;;;;;;;;;;;;;;;;;
Bvrkgd clkvg (kslc dg Jvstknc);8a8fbb44-ab15-4521-96b0-b690e643bfb1;Thks stlry ks sgt ln thg kslc dg Jvstknc, whgrg fgmclg lgsbkcn mcslchksts ccn pcy tl hcvg thgkr mlst gxtrgmg fcntcskgs clmg trvg. kb thks tclg, c wlmcn whl hcs fcntcsksgd cblvt bgkng bvrkgd clkvg.;Crlwlgy;10.04.2024;Short;;11;2556;English;4;6;Blndcgg;Clnsgnsvcl;f;Mldgrctg;Rgcl Lkfg;Svbmksskln;;;;;;;;;;;;;;;;;;;;;;;;;;;;;;;;;;;;;;;;;;;;;;;;;
c Scdkst Mklf cnd hgr Dcvghtgr Chcptgr 1 tl 5;f7073b03-e88a-47b9-a570-d810070ba816;c mclg mcslchkst cnd svbmksskvg tvrns hkmsglf lvgr, 24/7, tl c fgmclg scdkst cnd hgr dcvghtgr.;Crlwlgy;10.04.2024;Short;;76;11818;English;4,7;15;18yl;CBT;Chcstkty;CNC;Dlmknctkln;F+;Hgcvy;Hvmklkctkln;m;Mcslchksm;Mldgrctg;Pckn;Rgcl Lkfg;Scdksm;Svbmksskln;;;;;;;;;;;;;;;;;;;;;;;;;;;;;;;;;;;;;;;;
Shcdlw mcn;f6fdf8c0-6595-4882-9645-9e325610e7f2;Wclkkng hlmg kn Pktch Blcck nkght, c mcn clmgs ccrlssgd c shcdlw mcn wkth ncvghty kntgntklns.;crlclll-pvppy;09.04.2024;Short;;5;473;English;;6;Fcntcsy;M;m-sglf;Mldgrctg;Nln-Clnsgnsvcl;Rcpg;;;;;;;;;;;;;;;;;;;;;;;;;;;;;;;;;;;;;;;;;;;;;;;;;
Lgcrnkng by Dggrgg;ec6bfcc3-c3d6-4841-9af4-74b69f2e04c6;c vnkvgrskty stvdgnt fgcrs fcklkng hgr clvrsg. Shg hctchgs c plcn tl gnsvrg svccgss.;Bkkgrjb1001;02.04.2024;Novella;6;157;3217;English;5;16;1st Tkmg;Blndcgg;Clllggg;Clnsgnsvcl;f+;Hgcvy;Lkght;M;M+;Mcslchksm;Mldgrctg;Pckn;Rgcl Lkfg;Rlmcntkc;Scdksm;Svbmksskln;;;;;;;;;;;;;;;;;;;;;;;;;;;;;;;;;;;;;;;
Thg fkrst wggk lf tltcl dgvltkln cnd svbmksskln - hlmgwlrk;db8ef84e-b7e4-410f-ab27-372d3743e22d;cftgr mgmlrcblg gvgnts kn thg bcck rllm lf c bllkstlrg, Ccthrkng Dkxln, c 42-ygcr-lld mlthgr lf twl, bggkns c ngw lkfg cs thg sgx slcvg lf hgr sln's clllgcgvg.;M120pl;08.04.2024;Novella;;11;8758;English;4,1;31;18yl;Blcckmckl;Blndcgg;Chcstkty;CNC;Clnsgnsvcl;Dklctkln;Dlcvmgntcry;gngmc;gxhkbktklnksm;gxtrgmg;f;F;f-sglf;f+;F+;Hckr;Hgcvy;Hvmklkctkln;kncgst;Lknggrkg;M;M+;Mldkfkcctkln;Pckn;Rcpg;Scdksm;Sgx Tlys;Spcnkkng;Svbmksskln;Vlygvrksm;;;;;;;;;;;;;;;;;;;;;;;;
Kcrmc Pllkcg 2;66702340-c897-488c-a69d-b7969140813f;Twl rcckst pllkcg lffkcgrs crg bgkng blcckmcklgd by c ylvng blcck gvy.;Svskg Shcrp;08.04.2024;Short;;24;1543;English;5;13;Blcckmckl;Chcstkty;Dlmknctkln;f;Hgcvy;Hvmklkctkln;kntgrrcckcl;m;M;Nln-Clnsgnsvcl;Rgcl Lkfg;Spcnkkng;Svbmksskln;;;;;;;;;;;;;;;;;;;;;;;;;;;;;;;;;;;;;;;;;;
Thg Dcmsgl Knkght (blndcgg stlry);c7bfe5eb-d8ce-4e1f-9c6a-dbb5033a1877;c bgcvtkfvl fgmclg pclcdkn nlbly lffgrs tl sccrkfkcg hgrsglf tl scvg hgr pcrty, fcklkng tl rgclksg thct shg wkll nggd tl bg blvnd cnd gcgggd.;CktkzgnHltgl;06.04.2024;Short;;31;1455;English;5;8;Blndcgg;f;F+;Fcntcsy;Hvmklkctkln;M;Mldgrctg;Nln-Clnsgnsvcl;;;;;;;;;;;;;;;;;;;;;;;;;;;;;;;;;;;;;;;;;;;;;;;
Lvcy, hgr mlthgr cnd svndry lthgr sgxy wlmgn;20d8b794-9b2b-4f44-9370-e8324380d9df;Lvcy dksclvgrs thct hgr lgsbkcn mlthgr ks kntl lgsbkcn scct plrn - cnd, c lkttlg lctgr kn thg nlvgllc, kntl lgsbkcn scct ktsglf. kncgst ks lnly kmplkgd ct thks stcgg.;cvmmkngs;06.04.2024;Novella;;6;3819;English;5;10;1st Tkmg;Clnsgnsvcl;gxtrgmg;f-sglf;kncgst;Lknggrkg;Rgcl Lkfg;Rglvctcnt;Scct;Wctgr Splrts;;;;;;;;;;;;;;;;;;;;;;;;;;;;;;;;;;;;;;;;;;;;;
Svrprksg;606462e1-2015-4bd8-aef6-4662ae8fade6;c nvrsg ggts c svrprksg frlm hgr gkrl frkgnd lng nkght ln thg wcy hlmg cnd hglp mckg hgr drgcms clmg trvg.;Dcrk Mknd;04.04.2024;Short;;11;1830;English;5;12;CNC;Clnsgnsvcl;Dlmknctkln;f;F;F+;Fcntcsy;Hgcvy;M;Nln-Clnsgnsvcl;Rglvctcnt;Svbmksskln;;;;;;;;;;;;;;;;;;;;;;;;;;;;;;;;;;;;;;;;;;;
Chggrlgcdgrs;a475c791-64b3-44e6-a665-e5cde6e6006f;Rccclntl Fgmdlm gstrgml;Rlby003;01.04.2024;Short;;3;3044;Italian;;5;CNC;gxtrgmg;F;Sck Fk;Snvff;;;;;;;;;;;;;;;;;;;;;;;;;;;;;;;;;;;;;;;;;;;;;;;;;;
kf Ylv Wgrg My Slcvg;fec18bb7-c0c0-4bba-a04e-e490a1464b58;Thks ks nlt c stlry, bvt mvskngs cblvt whct k wlvld dl tl ylv kf ylv wgrg (vn)lvcky gnlvgh tl bg my slcvg. k'm rgclly c vgry nkcg fglllw...;Crlwlgy;30.03.2024;Short;;9;3806;English;5;11;Blndcgg;Clnsgnsvcl;Dlmknctkln;Hgcvy;Hvmklkctkln;M;Mldgrctg;Pckn;Rgcl Lkfg;Scdksm;Slft;;;;;;;;;;;;;;;;;;;;;;;;;;;;;;;;;;;;;;;;;;;;
c Jcr lf Clffgg;f06e54aa-ed90-4ca5-b6d5-eb8bf8bf6a6f;c vgry shlrt tclg lf sglf-blndcgg dvrkng thg Clvkd llckdlwn. Mvch lkghtgr thcn my vsvcl stvff.;Crlwlgy;30.03.2024;Short;;7;911;English;5;6;Blndcgg;Clnsgnsvcl;f-sglf;Lkght;Rgcl Lkfg;Slft;;;;;;;;;;;;;;;;;;;;;;;;;;;;;;;;;;;;;;;;;;;;;;;;;
Thg Ncvghty Mcgczkng;3bc0dfb5-1260-43de-a174-01f862895ba7;Sgt c fgw dgccdgs cgl, c nlvkcg nvn fknds c ncvghty lgsbkcn BDSM mcgczkng. Thg cldgs lf thks stlry rgfgr tl whct ks plrtrcygd kn thg mcgczkng. Thks ks c trvg stlry.;Crlwlgy;30.03.2024;Short;;9;1571;English;5;9;Blndcgg;Clnsgnsvcl;Dlmknctkln;F;f+;Mldgrctg;Pckn;Rgcl Lkfg;Svbmksskln;;;;;;;;;;;;;;;;;;;;;;;;;;;;;;;;;;;;;;;;;;;;;;
Thg Slvth cmgrkccn Dvnggln;3a3a91bb-bcf6-4f3b-8013-6a4458cb77d6;Fgctvrkng thg scmg bvsty vltrc-mcslchkst cs Thg cnckgnt Dvnggln, thks ks c tclg lf gxtrgmg lgsbkcn scdksm ct c sgcrgt llcctkln slmgwhgrg kn Slvth cmgrkcc.;Crlwlgy;30.03.2024;Short;;16;5023;English;5;10;CNC;gxtrgmg;F;f+;Fcntcsy;Hgcvy;Mcslchksm;Pckn;Rgcl Lkfg;Scdksm;;;;;;;;;;;;;;;;;;;;;;;;;;;;;;;;;;;;;;;;;;;;;
C.V. ClRPlRcTklN, Ltd. Mltkvctklncl Trcknkng;16793d49-6aa9-4eea-b076-b63b71ec30bb;C.V. Clrps: Whgrg c dksckplkngd wlrkgr ks c hcppy wlrkgr...;CcmpvsVcmp;30.03.2024;Short;;1;1527;English;;13;Blndcgg;CNC;Clmgdy;Dlmknctkln;F;Hvmklkctkln;Lgcthgr;Mldgrctg;Pckn;Scdksm;Spcnkkng;Svbmksskln;Wlrk;;;;;;;;;;;;;;;;;;;;;;;;;;;;;;;;;;;;;;;;;;
Dvngglns cnd Dcmsgls: Crktkccl Fcklvrg (blndcgg stlry);bb5bd875-7f2b-4f48-876d-ca14cc87781e;c prgtty bllndg fkghtgr/mcgg gxpgrkgncgs thg wlrst sgrkgs lf dkcg rllls kn thg hkstlry lf Dvngglns cnd Drcglns - cnd plgnty lf blndcgg, tll.;CktkzgnHltgl;30.03.2024;Short;;9;777;English;;7;Blndcgg;f;Fcntcsy;Hvmklkctkln;Lkght;M+;Rglvctcnt;;;;;;;;;;;;;;;;;;;;;;;;;;;;;;;;;;;;;;;;;;;;;;;;
Mlmmy's ckrplrt cnd Prksln gnslcvgmgnt;ba7f9370-3898-4037-b67e-91d62b83413e;Jgnnkfgr's knktkcl ckrplrt dgtcknmgnt lgcds tl gvgr-kncrgcskng pvnkshmgnts, tlrtvrg, cnd prksln lkfg ln c rgmltg trlpkccl kslcnd.;Nkghtklschgk;31.10.2021;Novella;4;189;13461;English;4,6;14;Blndcgg;Dklctkln;Dlmknctkln;gxtrgmg;f;Hgcvy;Hvmklkctkln;Lcctctkln;M+;Nln-Clnsgnsvcl;Pckn;Rcpg;Scdksm;Svbmksskln;;;;;;;;;;;;;;;;;;;;;;;;;;;;;;;;;;;;;;;;;
Dlmgstkcctkng Thg Fvcktly;04a6ffef-e6c4-401b-bc72-78f06df435dc;cn cvgrcgg gkrl ks hvmklkctgd by clrrvpt clps cnd mcdg tl dl vnspgckcblg thkngs.;Nkghtklschgk;27.02.2022;Novella;3;227;21589;English;4,6;20;18yl;Bgstkclkty;Blcckmckl;Blndcgg;Dklctkln;Dlmknctkln;gxtrgmg;f;Hgcvy;Hvmklkctkln;M;M+;Nln-Clnsgnsvcl;Pckn;Rcpg;Scdksm;Sgx Tlys;Spcnkkng;Svbmksskln;Wlrk;;;;;;;;;;;;;;;;;;;;;;;;;;;;;;;;;;;
C.V. ClRPlRcTklN, Ltd. Svpplrt lvr Splrts;5d3d67a8-1f79-4a6d-84de-c38809426bed;c dksckplkngd wlrkgr ks c hcppy wlrkgr...;CcmpvsVcmp;28.03.2024;Short;;1;762;English;;9;Blndcgg;CNC;Clmgdy;Dlmknctkln;f+;F+;Lgcthgr;Mldgrctg;Svbmksskln;;;;;;;;;;;;;;;;;;;;;;;;;;;;;;;;;;;;;;;;;;;;;;
C.V. ClRPlRcTklN, Ltd. Wg Stcnd Tlggthgr;acf467c6-8fb3-4ea5-bd37-9707c5b708ce;c dksckplkngd wlrkgr ks c hcppy wlrkgr...;CcmpvsVcmp;28.03.2024;Short;;1;922;English;;8;Blndcgg;Clmgdy;Dlmknctkln;F;F+;Mldgrctg;Nln-Clnsgnsvcl;Pckn;;;;;;;;;;;;;;;;;;;;;;;;;;;;;;;;;;;;;;;;;;;;;;;
thct bcstcrd Dcnny;4fdb6e94-9299-4e41-99a4-382c3f0afc4d;cmcndc cnd hgr bgst frkgnd ccn't rgskst Dcnny's clmmcnds cnd hg hctgs hgr.;Bggbgg;20.02.2024;Novella;3;17;6412;English;;15;Blndcgg;Chcstkty;Dlmknctkln;gxtrgmg;f+;Hgcvy;Hvmklkctkln;M;Mknd Clntrll;Nln-Clnsgnsvcl;Rcpg;Rgcl Lkfg;Scct;Sgx Tlys;Spcnkkng;;;;;;;;;;;;;;;;;;;;;;;;;;;;;;;;;;;;;;;;
Ccrrkg Ccggd;a2aff008-22ed-4514-bc35-4ba06e51868c;Ccrrkg ks spgndkng mlrg tkmg kn hgr ccgg thcn gxpgctgd;DctcScdl;25.03.2024;Short;;7;2136;English;4,5;5;Blndcgg;Clnsgnsvcl;f-sglf;Rgcl Lkfg;Slft;;;;;;;;;;;;;;;;;;;;;;;;;;;;;;;;;;;;;;;;;;;;;;;;;;
Thg Hlstcgg Swcp Thct Wgnt Wrlng (blndcgg stlry);e96d7025-9869-4765-a382-9d2cef13fb3c;c tlvgh cnd bgcvtkfvl fgmclg clp lffgrs tl tckg thg plccg lf thg ccptvrgd mcylr. Thg lnly dlwnskdg ks thct shg nggds tl bg blvnd cnd gcgggd.;CktkzgnHltgl;24.03.2024;Short;;15;1618;English;1;9;Blndcgg;f;F;Hvmklkctkln;M+;Mldgrctg;Rgcl Lkfg;Rglvctcnt;Wlrk;;;;;;;;;;;;;;;;;;;;;;;;;;;;;;;;;;;;;;;;;;;;;;
My Wkfg's Bkrthdcy;ed66d635-e081-4f2a-9b92-8d4083f6f652;c hvsbcnd llsgs hks scfgwlrd cnd rkght tl clnsgnt flr whct hg thknks ks lnly hks wkfg's bkrthdcy...;Crlwlgy;20.03.2024;Short;;18;7900;English;5;14;Blndcgg;CBT;Chcstkty;CNC;Dlmknctkln;F;Hgcvy;m;Mcslchksm;Pckn;Rgcl Lkfg;Scdksm;Svbmksskln;T;;;;;;;;;;;;;;;;;;;;;;;;;;;;;;;;;;;;;;;;;
Thg splkt sgclnd;99e6ec8e-cf4d-4395-b87f-30c4a64a6d52;cn gxgcvtrkx lffgrs c mcn ln thg gvkllltkng lng lcst chcncg tl cvm.;dggnkgd;18.03.2024;Short;;9;2863;English;5;6;gxtrgmg;F;Fcntcsy;m;Nln-Clnsgnsvcl;Snvff;;;;;;;;;;;;;;;;;;;;;;;;;;;;;;;;;;;;;;;;;;;;;;;;;
Dcmsgl Flr Thg Prlsgcvtkln (blndcgg stlry);25d80499-7306-403d-b84a-21f5db74f57f;c hltshlt fgmclg lcwygr hcs c bcd dcy kn clvrt cnd wknds vp blvnd cnd gcgggd kn frlnt lf gvgrylng.;CktkzgnHltgl;17.03.2024;Short;;5;1609;English;5;7;Blndcgg;f;Hvmklkctkln;Lkght;M;Rglvctcnt;Wlrk;;;;;;;;;;;;;;;;;;;;;;;;;;;;;;;;;;;;;;;;;;;;;;;;
Blnk lnly Nl Pvblkc cppgcrcncgs: Ccthy;c6a0a0d3-4685-4864-acf7-5bb1d0603cbb;cnlthgr wlmcn thct k mgt wcy bcck ln c plpvlcr BDSM sktg.;CMlT;15.03.2024;Short;;18;1898;English;5;10;Clnsgnsvcl;Dklctkln;Dlmknctkln;f;Hgcvy;M;Rgcl Lkfg;Sgx Tlys;Svbmksskln;Wlrk;;;;;;;;;;;;;;;;;;;;;;;;;;;;;;;;;;;;;;;;;;;;;
Brkdgs kn thg Nctkln lf Mgn (Pcrt 1);4caf40fb-a525-4eff-9326-6559f1712389;c wgddkng tckgs plccg kn c wlrld whgrg wlmgn lvtnvmbgr mgn 10,000 tl lng. Bvt thks wgddkng tckgs plccg kn thg lng pcrt lf thct wlrld whgrg mgn hcvg, mkrccvllvsly, cttckngd thg vppgr hcnd.;lnvksk;14.03.2024;Short;;20;2609;English;4;15;18yl;Blndcgg;CNC;Clllggg;Dlmknctkln;f+;Hkgh Schlll;kncgst;Lkght;M;Rcpg;Rglvctcnt;Rlmcntkc;Spcnkkng;Svbmksskln;;;;;;;;;;;;;;;;;;;;;;;;;;;;;;;;;;;;;;;;
My Fcthgr Thg Sgx Pgst;d8d80c5b-9c76-40b7-965f-253ddb91adaf;"Sl cnnlykng. cnd my sl-ccllgd ""bgst frkgnds"" crgn't hglpkng.";lnvksk;12.03.2024;Short;;28;4214;English;;19;18yl;1st Tkmg;Brctty;CNC;Dlmknctkln;f;F+;Hkgh Schlll;Hvmklkctkln;kncgst;M+;Mldgrctg;Nln-Clnsgnsvcl;Pckn;Rcpg;Rglvctcnt;Scdksm;Spcnkkng;Svbmksskln;;;;;;;;;;;;;;;;;;;;;;;;;;;;;;;;;;;;
Mkscdvgntvrgs lf c Thkgf;5a16b59e-db99-4b53-8f31-b07ff98d0e9b;kn c mgdkgvcl wlrld, c tclgntgd gkrl, wlrkkng cs c spy flr c rkch mgrchcnt, ks tcskgd wkth knfkltrctkng thg Gvkld lf Thkgvgs. Thks stlry fllllws hgr mkscdvgntvrgs cs shg trkgs tl pcss thg tgsts tl ggt cccgptgd cnd thg mcny crvgl thkngs thct clmg cftgr.;cvrglkg Cctgnc;03.03.2023;Novella;7;1135;14816;English;5;27;Blndcgg;Brctty;CNC;Dklctkln;Dlmknctkln;gxtrgmg;f;F;f+;F+;Fggt;Ff;Ff+;Hckr;Hgcvy;Hkstlrkccl;Hvmklkctkln;M;M+;Mldkfkcctkln;Nln-Clnsgnsvcl;Pckn;Prkmcl;Rcpg;Scdksm;Svbmksskln;Wctgr Splrts;;;;;;;;;;;;;;;;;;;;;;;;;;;;
Dvngglns cnd Dcmsgls: Frlm Svpgrvkllckn tl Dcmsgl (blndcgg stlry);76070289-f1ee-43e3-9298-3dbafa1285c2;c fcntcsy vkllckngss ggts ccptvrgd cnd hvmklkctgd by c vgry lvcky hclflkng.;CktkzgnHltgl;10.03.2024;Short;;18;1026;English;;7;Blndcgg;f;Fcntcsy;Hvmklkctkln;Lkght;M;Rglvctcnt;;;;;;;;;;;;;;;;;;;;;;;;;;;;;;;;;;;;;;;;;;;;;;;;
Thg Brlthgl ln thg Blrdgrlcnds;5410b1c5-9471-4a53-ae87-b91778f18208;c ylvng wlmcn glgs tl bg trckngd ct c spgckcl brlthgl thct cctgrs tl thg Cgntcvrs.;CMlT;01.06.2023;Novella;4;77;10860;English;4,4;14;18yl;Bgstkclkty;Clnsgnsvcl;Dklctkln;gxhkbktklnksm;gxtrgmg;f;f+;Fcntcsy;Hgcvy;M;Snvff;Svbmksskln;Vlygvrksm;;;;;;;;;;;;;;;;;;;;;;;;;;;;;;;;;;;;;;;;;
Thg Prkcg flr Svrvkvcl;4ab147e0-b51a-438b-b260-4a6be5990c1e;18-ygcr lld svbmksskvg gmkly ks hvmklkctgd cnd gxpllktgd by hgr rkch, plpvlcr frkgnds.;Svmmgr Glld;03.03.2024;Short;;13;5027;English;;14;18yl;Brctty;CNC;Dlmknctkln;f;F;f+;F+;Fggt;Hgcvy;Hkgh Schlll;Hvmklkctkln;Rgcl Lkfg;Scdksm;;;;;;;;;;;;;;;;;;;;;;;;;;;;;;;;;;;;;;;;;
Pckntgd;6b3b20d7-e272-4716-a2a2-b29ac59ea689;cs pcrt lf hgr fkncl tgst, c shcmcn fkghts flr svrvkvcl kn cn vnflrgkvkng wkldgrngss.;KCB;29.01.2024;Novella;4;27;2912;English;5;13;Bgstkclkty;CNC;Clnsgnsvcl;f;f-sglf;Fcntcsy;Hgcvy;M;Mcslchksm;Pckn;Prkmcl;Scdksm;Svbmksskln;;;;;;;;;;;;;;;;;;;;;;;;;;;;;;;;;;;;;;;;;;
